{
  "efficiency": {
    "wall_clock_s": 0,
    "active_agent_s": 0,
    "tokens_in": 0,
    "tokens_out": 0,
    "tokens_total": 0,
    "cost_usd": 0
  },
  "outcome_quality": {
    "acceptance_pass": true,
    "acceptance_coverage": 1.0,
    "rework_turns": 1,
    "artifact_completeness": 1.0
  },
  "protocol_labels": {
    "scenario": "scenario2",
    "case_id": "case-2-all-functional-requirements",
    "tool": "cursor",
    "model": "composer",
    "plinth_config": "bare-agent",
    "commit": "0318a570a9577ca7c6671b7f2d30ac01aaa95e3e",
    "retry_count": 0,
    "human_intervention_min": 0
  },
  "plinth_usage": {
    "skills_count": 2,
    "commands_count": 0,
    "agents_count": 0,
    "skills": [
      "400-frameworks-quarkus-create-project",
      "423-frameworks-quarkus-testing-acceptance-tests"
    ],
    "commands": [],
    "agents": []
  },
  "solution_snapshot": {
    "demo_root": "benchmarks/problem2/scenario2/demo/",
    "tree_format": "unix-tree",
    "tree_encoding": "base64",
    "tree_b64": "YmVuY2htYXJrcy9wcm9ibGVtMi9zY2VuYXJpbzIvZGVtbwrilJzilIDilIAgLmdpdGtlZXAK4pSc4pSA4pSAIHBvbS54bWwK4pSU4pSA4pSAIHNyYwogICAg4pSc4pSA4pSAIG1haW4KICAgIOKUgsKgwqAg4pSc4pSA4pSAIGphdmEKICAgIOKUgsKgwqAg4pSCwqDCoCDilJTilIDilIAgaW5mbwogICAg4pSCwqDCoCDilILCoMKgICAgICDilJTilIDilIAgamFiCiAgICDilILCoMKgIOKUgsKgwqAgICAgICAgICDilJTilIDilIAgZ3JlZWtnb2RzCiAgICDilILCoMKgIOKUgsKgwqAgICAgICAgICAgICAg4pSc4pSA4pSAIEdvZFVwZGF0ZXIuamF2YQogICAg4pSCwqDCoCDilILCoMKgICAgICAgICAgICAgIOKUnOKUgOKUgCBHcmVla0dvZC5qYXZhCiAgICDilILCoMKgIOKUgsKgwqAgICAgICAgICAgICAg4pSc4pSA4pSAIEdyZWVrR29kUGVyc2lzdGVuY2VFeGNlcHRpb24uamF2YQogICAg4pSCwqDCoCDilILCoMKgICAgICAgICAgICAgIOKUnOKUgOKUgCBHcmVla0dvZFJlcG9zaXRvcnkuamF2YQogICAg4pSCwqDCoCDilILCoMKgICAgICAgICAgICAgIOKUnOKUgOKUgCBHcmVla0dvZFJlcG91cmNlLmphdmEKICAgIOKUgsKgwqAg4pSCwqDCoCAgICAgICAgICAgICDilJzilIDilIAgR3JlZWtHb2RTZXJ2aWNlLmphdmEKICAgIOKUgsKgwqAg4pSCwqDCoCAgICAgICAgICAgICDilJTilIDilIAgR3JlZWtHb2RTeW5jRXhjZXB0aW9uLmphdmEKICAgIOKUgsKgwqAg4pSU4pSA4pSAIHJlc291cmNlcwogICAg4pSCwqDCoCAgICAg4pSc4pSA4pSAIGFwcGxpY2F0aW9uLnByb3BlcnRpZXMKICAgIOKUgsKgwqAgICAgIOKUlOKUgOKUgCBkYgogICAg4pSCwqDCoCAgICAgICAgIOKUlOKUgOKUgCBtaWdyYXRpb24KICAgIOKUgsKgwqAgICAgICAgICAgICAg4pSU4pSA4pSAIFYxX19ncmVla19nb2Quc3FsCiAgICDilJTilIDilIAgdGVzdAogICAgICAgIOKUnOKUgOKUgCBqYXZhCiAgICAgICAg4pSCwqDCoCDilJTilIDilIAgaW5mbwogICAgICAgIOKUgsKgwqAgICAgIOKUlOKUgOKUgCBqYWIKICAgICAgICDilILCoMKgICAgICAgICAg4pSU4pSA4pSAIGdyZWVrZ29kcwogICAgICAgIOKUgsKgwqAgICAgICAgICAgICAg4pSc4pSA4pSAIEdvZFVwZGF0ZXJUZXN0LmphdmEKICAgICAgICDilILCoMKgICAgICAgICAgICAgIOKUlOKUgOKUgCBHcmVla0dvZHNBcGlBVC5qYXZhCiAgICAgICAg4pSU4pSA4pSAIHJlc291cmNlcwogICAgICAgICAgICDilJTilIDilIAgYXBwbGljYXRpb24ucHJvcGVydGllcwoKMTYgZGlyZWN0b3JpZXMsIDE0IGZpbGVzCg==",
    "pom_xml_b64": "PD94bWwgdmVyc2lvbj0iMS4wIiBlbmNvZGluZz0iVVRGLTgiPz4KPHByb2plY3QgeG1sbnM9Imh0dHA6Ly9tYXZlbi5hcGFjaGUub3JnL1BPTS80LjAuMCIKICAgICAgICAgeG1sbnM6eHNpPSJodHRwOi8vd3d3LnczLm9yZy8yMDAxL1hNTFNjaGVtYS1pbnN0YW5jZSIKICAgICAgICAgeHNpOnNjaGVtYUxvY2F0aW9uPSJodHRwOi8vbWF2ZW4uYXBhY2hlLm9yZy9QT00vNC4wLjAgaHR0cHM6Ly9tYXZlbi5hcGFjaGUub3JnL3hzZC9tYXZlbi00LjAuMC54c2QiPgogICAgPG1vZGVsVmVyc2lvbj40LjAuMDwvbW9kZWxWZXJzaW9uPgoKICAgIDxncm91cElkPmluZm8uamFiLmdyZWVrZ29kczwvZ3JvdXBJZD4KICAgIDxhcnRpZmFjdElkPmdyZWVrLWdvZHMtYXBpPC9hcnRpZmFjdElkPgogICAgPHZlcnNpb24+MS4wLjAtU05BUFNIT1Q8L3ZlcnNpb24+CiAgICA8cGFja2FnaW5nPmphcjwvcGFja2FnaW5nPgoKICAgIDxwcm9wZXJ0aWVzPgogICAgICAgIDxwcm9qZWN0LmJ1aWxkLnNvdXJjZUVuY29kaW5nPlVURi04PC9wcm9qZWN0LmJ1aWxkLnNvdXJjZUVuY29kaW5nPgogICAgICAgIDxtYXZlbi5jb21waWxlci5yZWxlYXNlPjIxPC9tYXZlbi5jb21waWxlci5yZWxlYXNlPgogICAgICAgIDxxdWFya3VzLnBsYXRmb3JtLnZlcnNpb24+My4xOC4zPC9xdWFya3VzLnBsYXRmb3JtLnZlcnNpb24+CiAgICAgICAgPHN1cmVmaXJlLXBsdWdpbi52ZXJzaW9uPjMuNS4yPC9zdXJlZmlyZS1wbHVnaW4udmVyc2lvbj4KICAgIDwvcHJvcGVydGllcz4KCiAgICA8ZGVwZW5kZW5jeU1hbmFnZW1lbnQ+CiAgICAgICAgPGRlcGVuZGVuY2llcz4KICAgICAgICAgICAgPGRlcGVuZGVuY3k+CiAgICAgICAgICAgICAgICA8Z3JvdXBJZD5pby5xdWFya3VzLnBsYXRmb3JtPC9ncm91cElkPgogICAgICAgICAgICAgICAgPGFydGlmYWN0SWQ+cXVhcmt1cy1ib208L2FydGlmYWN0SWQ+CiAgICAgICAgICAgICAgICA8dmVyc2lvbj4ke3F1YXJrdXMucGxhdGZvcm0udmVyc2lvbn08L3ZlcnNpb24+CiAgICAgICAgICAgICAgICA8dHlwZT5wb208L3R5cGU+CiAgICAgICAgICAgICAgICA8c2NvcGU+aW1wb3J0PC9zY29wZT4KICAgICAgICAgICAgPC9kZXBlbmRlbmN5PgogICAgICAgIDwvZGVwZW5kZW5jaWVzPgogICAgPC9kZXBlbmRlbmN5TWFuYWdlbWVudD4KCiAgICA8ZGVwZW5kZW5jaWVzPgogICAgICAgIDxkZXBlbmRlbmN5PgogICAgICAgICAgICA8Z3JvdXBJZD5pby5xdWFya3VzPC9ncm91cElkPgogICAgICAgICAgICA8YXJ0aWZhY3RJZD5xdWFya3VzLWFyYzwvYXJ0aWZhY3RJZD4KICAgICAgICA8L2RlcGVuZGVuY3k+CiAgICAgICAgPGRlcGVuZGVuY3k+CiAgICAgICAgICAgIDxncm91cElkPmlvLnF1YXJrdXM8L2dyb3VwSWQ+CiAgICAgICAgICAgIDxhcnRpZmFjdElkPnF1YXJrdXMtcmVzdDwvYXJ0aWZhY3RJZD4KICAgICAgICA8L2RlcGVuZGVuY3k+CiAgICAgICAgPGRlcGVuZGVuY3k+CiAgICAgICAgICAgIDxncm91cElkPmlvLnF1YXJrdXM8L2dyb3VwSWQ+CiAgICAgICAgICAgIDxhcnRpZmFjdElkPnF1YXJrdXMtcmVzdC1qYWNrc29uPC9hcnRpZmFjdElkPgogICAgICAgIDwvZGVwZW5kZW5jeT4KICAgICAgICA8ZGVwZW5kZW5jeT4KICAgICAgICAgICAgPGdyb3VwSWQ+aW8ucXVhcmt1czwvZ3JvdXBJZD4KICAgICAgICAgICAgPGFydGlmYWN0SWQ+cXVhcmt1cy1qZGJjLXBvc3RncmVzcWw8L2FydGlmYWN0SWQ+CiAgICAgICAgPC9kZXBlbmRlbmN5PgogICAgICAgIDxkZXBlbmRlbmN5PgogICAgICAgICAgICA8Z3JvdXBJZD5pby5xdWFya3VzPC9ncm91cElkPgogICAgICAgICAgICA8YXJ0aWZhY3RJZD5xdWFya3VzLWZseXdheTwvYXJ0aWZpY3RJZD4KICAgICAgICA8L2RlcGVuZGVuY3k+CiAgICAgICAgPGRlcGVuZGVuY3k+CiAgICAgICAgICAgIDxncm91cElkPmlvLnF1YXJrdXM8L2dyb3VwSWQ+CiAgICAgICAgICAgIDxhcnRpZmFjdElkPnF1YXJrdXMtc2NoZWR1bGVyPC9hcnRpZmFjdElkPgogICAgICAgIDwvZGVwZW5kZW5jeT4KICAgICAgICA8ZGVwZW5kZW5jeT4KICAgICAgICAgICAgPGdyb3VwSWQ+aW8ucXVhcmt1czwvZ3JvdXBJZD4KICAgICAgICAgICAgPGFydGlmYWN0SWQ+cXVhcmt1cy1zbWFsbHJ5ZS1vcGVuYXBpPC9hcnRpZmFjdElkPgogICAgICAgIDwvZGVwZW5kZW5jeT4KCiAgICAgICAgPGRlcGVuZGVuY3k+CiAgICAgICAgICAgIDxncm91cElkPmlvLnF1YXJrdXM8L2dyb3VwSWQ+CiAgICAgICAgICAgIDxhcnRpZmFjdElkPnF1YXJrdXMtanVuaXQ1PC9hcnRpZmFjdElkPgogICAgICAgICAgICA8c2NvcGU+dGVzdDwvc2NvcGU+CiAgICAgICAgPC9kZXBlbmRlbmN5PgogICAgICAgIDxkZXBlbmRlbmN5PgogICAgICAgICAgICA8Z3JvdXBJZD5pby5yZXN0LWFzc3VyZWQ8L2dyb3VwSWQ+CiAgICAgICAgICAgIDxhcnRpZmFjdElkPnJlc3QtYXNzdXJlZDwvYXJ0aWZhY3RJZD4KICAgICAgICAgICAgPHNjb3BlPnRlc3Q8L3Njb3BlPgogICAgICAgIDwvZGVwZW5kZW5jeT4KICAgICAgICA8ZGVwZW5kZW5jeT4KICAgICAgICAgICAgPGdyb3VwSWQ+aW8ucXVhcmt1czwvZ3JvdXBJZD4KICAgICAgICAgICAgPGFydGlmYWN0SWQ+cXVhcmt1cy1qdW5pdDUtbW9ja2l0bzwvYXJ0aWZhY3RJZD4KICAgICAgICAgICAgPHNjb3BlPnRlc3Q8L3Njb3BlPgogICAgICAgIDwvZGVwZW5kZW5jeT4KICAgICAgICA8ZGVwZW5kZW5jeT4KICAgICAgICAgICAgPGdyb3VwSWQ+b3JnLndpcmVtb2NrPC9ncm91cElkPgogICAgICAgICAgICA8YXJ0aWZhY3RJZD53aXJlbW9jay1zdGFuZGFsb25lPC9hcnRpZmFjdElkPgogICAgICAgICAgICA8dmVyc2lvbj4zLjEwLjA8L3ZlcnNpb24+CiAgICAgICAgICAgIDxzY29wZT50ZXN0PC9zY29wZT4KICAgICAgICA8L2RlcGVuZGVuY3k+CiAgICA8L2RlcGVuZGVuY2llcz4KCiAgICA8YnVpbGQ+CiAgICAgICAgPHBsdWdpbnM+CiAgICAgICAgICAgIDxwbHVnaW4+CiAgICAgICAgICAgICAgICA8Z3JvdXBJZD5pby5xdWFya3VzLnBsYXRmb3JtPC9ncm91cElkPgogICAgICAgICAgICAgICAgPGFydGlmYWN0SWQ+cXVhcmt1cy1tYXZlbi1wbHVnaW48L2FydGlmYWN0SWQ+CiAgICAgICAgICAgICAgICA8dmVyc2lvbj4ke3F1YXJrdXMucGxhdGZvcm0udmVyc2lvbn08L3ZlcnNpb24+CiAgICAgICAgICAgICAgICA8ZXh0ZW5zaW9ucz50cnVlPC9leHRlbnNpb25zPgogICAgICAgICAgICAgICAgPGV4ZWN1dGlvbnM+CiAgICAgICAgICAgICAgICAgICAgPGV4ZWN1dGlvbj4KICAgICAgICAgICAgICAgICAgICAgICAgPGdvYWxzPgogICAgICAgICAgICAgICAgICAgICAgICAgICAgPGdvYWw+YnVpbGQ8L2dvYWw+CiAgICAgICAgICAgICAgICAgICAgICAgIDwvZ29hbHM+CiAgICAgICAgICAgICAgICAgICAgPC9leGVjdXRpb24+CiAgICAgICAgICAgICAgICA8L2V4ZWN1dGlvbnM+CiAgICAgICAgICAgIDwvcGx1Z2luPgogICAgICAgICAgICA8cGx1Z2luPgogICAgICAgICAgICAgICAgPGFydGlmYWN0SWQ+bWF2ZW4tc3VyZWZpcmUtcGx1Z2luPC9hcnRpZmFjdElkPgogICAgICAgICAgICAgICAgPHZlcnNpb24+JHtzdXJlZmlyZS1wbHVnaW4udmVyc2lvbn08L3ZlcnNpb24+CiAgICAgICAgICAgICAgICA8Y29uZmlndXJhdGlvbj4KICAgICAgICAgICAgICAgICAgICA8ZXhjbHVkZXM+CiAgICAgICAgICAgICAgICAgICAgICAgIDxleGNsdWRlPioqLypBVC5qYXZhPC9leGNsdWRlPgogICAgICAgICAgICAgICAgICAgIDwvZXhjbHVkZXM+CiAgICAgICAgICAgICAgICA8L2NvbmZpZ3VyYXRpb24+CiAgICAgICAgICAgIDwvcGx1Z2luPgogICAgICAgICAgICA8cGx1Z2luPgogICAgICAgICAgICAgICAgPGFydGlmYWN0SWQ+bWF2ZW4tZmFpbHNhZmUtcGx1Z2luPC9hcnRpZmFjdElkPgogICAgICAgICAgICAgICAgPHZlcnNpb24+JHtzdXJlZmlyZS1wbHVnaW4udmVyc2lvbn08L3ZlcnNpb24+CiAgICAgICAgICAgICAgICA8ZXhlY3V0aW9ucz4KICAgICAgICAgICAgICAgICAgICA8ZXhlY3V0aW9uPgogICAgICAgICAgICAgICAgICAgICAgICA8Z29hbHM+CiAgICAgICAgICAgICAgICAgICAgICAgICAgICA8Z29hbD5pbnRlZ3JhdGlvbi10ZXN0PC9nb2FsPgogICAgICAgICAgICAgICAgICAgICAgICAgICAgPGdvYWw+dmVyaWZ5PC9nb2FsPgogICAgICAgICAgICAgICAgICAgICAgICA8L2dvYWxzPgogICAgICAgICAgICAgICAgICAgIDwvZXhlY3V0aW9uPgogICAgICAgICAgICAgICAgPC9leGVjdXRpb25zPgogICAgICAgICAgICAgICAgPGNvbmZpZ3VyYXRpb24+CiAgICAgICAgICAgICAgICAgICAgPGluY2x1ZGVzPgogICAgICAgICAgICAgICAgICAgICAgICA8aW5jbHVkZT4qKi8qQVQuamF2YTwvaW5jbHVkZT4KICAgICAgICAgICAgICAgICAgICA8L2luY2x1ZGVzPgogICAgICAgICAgICAgICAgPC9jb25maWd1cmF0aW9uPgogICAgICAgICAgICA8L3BsdWdpbj4KICAgICAgICA8L3BsdWdpbnM+CiAgICA8L2J1aWxkPgo8L3Byb2plY3Q+Cg==",
    "file_count": 13
  }
}
