{
  "efficiency": {
    "wall_clock_s": 1100,
    "active_agent_s": 1000,
    "tokens_in": 200000,
    "tokens_out": 10000,
    "tokens_total": 210000,
    "cost_usd": 0.5
  },
  "outcome_quality": {
    "acceptance_pass": true,
    "acceptance_coverage": 1.0,
    "rework_turns": 2,
    "artifact_completeness": 1.0
  },
  "protocol_labels": {
    "scenario": "scenario1",
    "case_id": "case-1-readme-only",
    "tool": "claude-code",
    "model": "claude-sonnet-5",
    "plinth_config": "bare-agent",
    "commit": "ccfc63485e107ee42382481958d63bedc69b920d",
    "retry_count": 0,
    "human_intervention_min": 0
  },
  "plinth_usage": {
    "skills_count": 0,
    "commands_count": 0,
    "agents_count": 0,
    "skills": [],
    "commands": [],
    "agents": []
  },
  "solution_snapshot": {
    "demo_root": "benchmarks/problem2/scenario1/demo/",
    "tree_format": "unix-tree",
    "tree_encoding": "base64",
    "tree_b64": "LgrilJzilIDilIAgLmdpdGtlZXAK4pSc4pSA4pSAIHBvbS54bWwK4pSU4pSA4pSAIHNyYwogICAg4pSc4pSA4pSAIG1haW4KICAgIOKUgsKgwqAg4pSc4pSA4pSAIGphdmEKICAgIOKUgsKgwqAg4pSCwqDCoCDilJTilIDilIAgaW5mbwogICAg4pSCwqDCoCDilILCoMKgICAgICDilJTilIDilIAgamFiCiAgICDilILCoMKgIOKUgsKgwqAgICAgICAgICDilJTilIDilIAgcGxpbnRoCiAgICDilILCoMKgIOKUgsKgwqAgICAgICAgICAgICAg4pSU4pSA4pSAIGdvZHMKICAgIOKUgsKgwqAg4pSCwqDCoCAgICAgICAgICAgICAgICAg4pSc4pSA4pSAIEdvZC5qYXZhCiAgICDilILCoMKgIOKUgsKgwqAgICAgICAgICAgICAgICAgIOKUnOKUgOKUgCBHb2RDb250cm9sbGVyLmphdmEKICAgIOKUgsKgwqAg4pSCwqDCoCAgICAgICAgICAgICAgICAg4pSc4pSA4pSAIEdvZFJlcG9zaXRvcnkuamF2YQogICAg4pSCwqDCoCDilILCoMKgICAgICAgICAgICAgICAgICDilJzilIDilIAgR29kU3luY1NlcnZpY2UuamF2YQogICAg4pSCwqDCoCDilILCoMKgICAgICAgICAgICAgICAgICDilJzilIDilIAgR3JlZWtHb2ROYW1lc0NsaWVudC5qYXZhCiAgICDilILCoMKgIOKUgsKgwqAgICAgICAgICAgICAgICAgIOKUnOKUgOKUgCBHcmVla0dvZHNBcGlBcHBsaWNhdGlvbi5qYXZhCiAgICDilILCoMKgIOKUgsKgwqAgICAgICAgICAgICAgICAgIOKUnOKUgOKUgCBJbk1lbW9yeUdvZFJlcG9zaXRvcnkuamF2YQogICAg4pSCwqDCoCDilILCoMKgICAgICAgICAgICAgICAgICDilJTilIDilIAgTXlKc29uU2VydmVyR3JlZWtHb2ROYW1lc0NsaWVudC5qYXZhCiAgICDilILCoMKgIOKUlOKUgOKUgCByZXNvdXJjZXMKICAgIOKUgsKgwqAgICAgIOKUlOKUgOKUgCBhcHBsaWNhdGlvbi5wcm9wZXJ0aWVzCiAgICDilJTilIDilIAgdGVzdAogICAgICAgIOKUlOKUgOKUgCBqYXZhCiAgICAgICAgICAgIOKUlOKUgOKUgCBpbmZvCiAgICAgICAgICAgICAgICDilJTilIDilIAgamFiCiAgICAgICAgICAgICAgICAgICAg4pSU4pSA4pSAIHBsaW50aAogICAgICAgICAgICAgICAgICAgICAgICDilJTilIDilIAgZ29kcwogICAgICAgICAgICAgICAgICAgICAgICAgICAg4pSc4pSA4pSAIEdyZWVrR29kc0FwaUFjY2VwdGFuY2VUZXN0LmphdmEKICAgICAgICAgICAgICAgICAgICAgICAgICAgIOKUlOKUgOKUgCBTdHViR3JlZWtHb2ROYW1lc0NsaWVudC5qYXZhCgoxNSBkaXJlY3RvcmllcywgMTMgZmlsZXMK",
    "pom_xml_b64": "PD94bWwgdmVyc2lvbj0iMS4wIiBlbmNvZGluZz0iVVRGLTgiPz4KPHByb2plY3QgeG1sbnM9Imh0dHA6Ly9tYXZlbi5hcGFjaGUub3JnL1BPTS80LjAuMCIKICAgICAgICAgeG1sbnM6eHNpPSJodHRwOi8vd3d3LnczLm9yZy8yMDAxL1hNTFNjaGVtYS1pbnN0YW5jZSIKICAgICAgICAgeHNpOnNjaGVtYUxvY2F0aW9uPSJodHRwOi8vbWF2ZW4uYXBhY2hlLm9yZy9QT00vNC4wLjAgaHR0cHM6Ly9tYXZlbi5hcGFjaGUub3JnL3hzZC9tYXZlbi00LjAuMC54c2QiPgogIDxtb2RlbFZlcnNpb24+NC4wLjA8L21vZGVsVmVyc2lvbj4KCiAgPHBhcmVudD4KICAgIDxncm91cElkPm9yZy5zcHJpbmdmcmFtZXdvcmsuYm9vdDwvZ3JvdXBJZD4KICAgIDxhcnRpZmFjdElkPnNwcmluZy1ib290LXN0YXJ0ZXItcGFyZW50PC9hcnRpZmFjdElkPgogICAgPHZlcnNpb24+NC4wLjA8L3ZlcnNpb24+CiAgICA8cmVsYXRpdmVQYXRoLz4KICA8L3BhcmVudD4KCiAgPGdyb3VwSWQ+aW5mby5qYWIucGxpbnRoPC9ncm91cElkPgogIDxhcnRpZmFjdElkPmdyZWVrLWdvZHMtYXBpPC9hcnRpZmFjdElkPgogIDx2ZXJzaW9uPjEuMC4wLVNOQVBTSE9UPC92ZXJzaW9uPgogIDxwYWNrYWdpbmc+amFyPC9wYWNrYWdpbmc+CgogIDxwcm9wZXJ0aWVzPgogICAgPGphdmEudmVyc2lvbj4yNTwvamF2YS52ZXJzaW9uPgogICAgPG1hdmVuLmNvbXBpbGVyLnJlbGVhc2U+MjU8L21hdmVuLmNvbXBpbGVyLnJlbGVhc2U+CiAgPC9wcm9wZXJ0aWVzPgoKICA8ZGVwZW5kZW5jaWVzPgogICAgPGRlcGVuZGVuY3k+CiAgICAgIDxncm91cElkPm9yZy5zcHJpbmdmcmFtZXdvcmsuYm9vdDwvZ3JvdXBJZD4KICAgICAgPGFydGlmYWN0SWQ+c3ByaW5nLWJvb3Qtc3RhcnRlci13ZWI8L2FydGlmYWN0SWQ+CiAgICA8L2RlcGVuZGVuY3k+CgogICAgPGRlcGVuZGVuY3k+CiAgICAgIDxncm91cElkPm9yZy5zcHJpbmdmcmFtZXdvcmsuYm9vdDwvZ3JvdXBJZD4KICAgICAgPGFydGlmYWN0SWQ+c3ByaW5nLWJvb3Qtc3RhcnRlci10ZXN0PC9hcnRpZmFjdElkPgogICAgICA8c2NvcGU+dGVzdDwvc2NvcGU+CiAgICA8L2RlcGVuZGVuY3k+CgogICAgPGRlcGVuZGVuY3k+CiAgICAgIDxncm91cElkPm9yZy5zcHJpbmdmcmFtZXdvcmsuYm9vdDwvZ3JvdXBJZD4KICAgICAgPGFydGlmYWN0SWQ+c3ByaW5nLWJvb3Qtc3RhcnRlci13ZWJtdmMtdGVzdDwvYXJ0aWZhY3RJZD4KICAgICAgPHNjb3BlPnRlc3Q8L3Njb3BlPgogICAgPC9kZXBlbmRlbmN5PgogIDwvZGVwZW5kZW5jaWVzPgoKICA8YnVpbGQ+CiAgICA8cGx1Z2lucz4KICAgICAgPHBsdWdpbj4KICAgICAgICA8Z3JvdXBJZD5vcmcuc3ByaW5nZnJhbWV3b3JrLmJvb3Q8L2dyb3VwSWQ+CiAgICAgICAgPGFydGlmYWN0SWQ+c3ByaW5nLWJvb3QtbWF2ZW4tcGx1Z2luPC9hcnRpZmFjdElkPgogICAgICA8L3BsdWdpbj4KICAgIDwvcGx1Z2lucz4KICA8L2J1aWxkPgoKPC9wcm9qZWN0Pgo=",
    "file_count": 12
  }
}
