{
  "efficiency": {
    "wall_clock_s": 330,
    "active_agent_s": 300,
    "tokens_in": 25000,
    "tokens_out": 9000,
    "tokens_total": 34000,
    "cost_usd": 0
  },
  "outcome_quality": {
    "acceptance_pass": true,
    "acceptance_coverage": 1.0,
    "rework_turns": 2,
    "artifact_completeness": 1.0
  },
  "protocol_labels": {
    "scenario": "scenario3",
    "case_id": "case-3-current-openspec-problem2",
    "tool": "codex",
    "model": "gpt-5.6",
    "plinth_config": "full-plinth",
    "commit": "e82d1dcbe077aa135daade4a6b9ef222fefd6277",
    "retry_count": 2,
    "human_intervention_min": 0
  },
  "plinth_usage": {
    "skills_count": 2,
    "commands_count": 0,
    "agents_count": 0,
    "skills": [
      "133-java-testing-acceptance-tests",
      "423-frameworks-quarkus-testing-acceptance-tests"
    ],
    "commands": [],
    "agents": []
  },
  "solution_snapshot": {
    "demo_root": "benchmarks/problem2/scenario3/demo/",
    "tree_format": "unix-tree",
    "tree_encoding": "base64",
    "tree_b64": "Lgp8LS0gLmdpdGtlZXAKfC0tIHBvbS54bWwKYC0tIHNyYwogICAgfC0tIG1haW4KICAgIHwgICB8LS0gamF2YQogICAgfCAgIHwgICBgLS0gY29tCiAgICB8ICAgfCAgICAgICBgLS0gZXhhbXBsZQogICAgfCAgIHwgICAgICAgICAgIGAtLSBncmVla2dvZHMKICAgIHwgICB8ICAgICAgICAgICAgICAgfC0tIEdyZWVrR29kLmphdmEKICAgIHwgICB8ICAgICAgICAgICAgICAgfC0tIEdyZWVrR29kUGVyc2lzdGVuY2VFeGNlcHRpb24uamF2YQogICAgfCAgIHwgICAgICAgICAgICAgICB8LS0gR3JlZWtHb2RSZXBvc2l0b3J5LmphdmEKICAgIHwgICB8ICAgICAgICAgICAgICAgfC0tIEdyZWVrR29kUmVzb3VyY2UuamF2YQogICAgfCAgIHwgICAgICAgICAgICAgICB8LS0gR3JlZWtHb2RTZXJ2aWNlLmphdmEKICAgIHwgICB8ICAgICAgICAgICAgICAgfC0tIEdyZWVrR29kU291cmNlQ2xpZW50LmphdmEKICAgIHwgICB8ICAgICAgICAgICAgICAgYC0tIEdyZWVrR29kVXBkYXRlci5qYXZhCiAgICB8ICAgYC0tIHJlc291cmNlcwogICAgfCAgICAgICB8LS0gYXBwbGljYXRpb24ucHJvcGVydGllcwogICAgfCAgICAgICBgLS0gZGIKICAgIHwgICAgICAgICAgIGAtLSBtaWdyYXRpb24KICAgIHwgICAgICAgICAgICAgICBgLS0gVjFfX2NyZWF0ZV9ncmVla19nb2Quc3FsCiAgICBgLS0gdGVzdAogICAgICAgIHwtLSBqYXZhCiAgICAgICAgfCAgIGAtLSBjb20KICAgICAgICB8ICAgICAgIGAtLSBleGFtcGxlCiAgICAgICAgfCAgICAgICAgICAgYC0tIGdyZWVrZ29kcwogICAgICAgIHwgICAgICAgICAgICAgICB8LS0gQmFzZUFjY2VwdGFuY2VUZXN0LmphdmEKICAgICAgICB8ICAgICAgICAgICAgICAgfC0tIEdyZWVrR29kUmVwb3NpdG9yeUlULmphdmEKICAgICAgICB8ICAgICAgICAgICAgICAgYC0tIEdyZWVrR29kc1Jlc291cmNlQVQuamF2YQogICAgICAgIGAtLSByZXNvdXJjZXMKICAgICAgICAgICAgYC0tIGFwcGxpY2F0aW9uLnByb3BlcnRpZXMKCjE2IGRpcmVjdG9yaWVzLCAxNSBmaWxlcwo=",
    "pom_xml_b64": "PD94bWwgdmVyc2lvbj0iMS4wIiBlbmNvZGluZz0iVVRGLTgiPz4KPHByb2plY3QgeG1sbnM9Imh0dHA6Ly9tYXZlbi5hcGFjaGUub3JnL1BPTS80LjAuMCIKICAgICAgICAgeG1sbnM6eHNpPSJodHRwOi8vd3d3LnczLm9yZy8yMDAxL1hNTFNjaGVtYS1pbnN0YW5jZSIKICAgICAgICAgeHNpOnNjaGVtYUxvY2F0aW9uPSJodHRwOi8vbWF2ZW4uYXBhY2hlLm9yZy9QT00vNC4wLjAgaHR0cHM6Ly9tYXZlbi5hcGFjaGUub3JnL3hzZC9tYXZlbi00LjAuMC54c2QiPgogIDxtb2RlbFZlcnNpb24+NC4wLjA8L21vZGVsVmVyc2lvbj4KCiAgPGdyb3VwSWQ+Y29tLmV4YW1wbGU8L2dyb3VwSWQ+CiAgPGFydGlmYWN0SWQ+Z3JlZWstZ29kcy1hcGk8L2FydGlmYWN0SWQ+CiAgPHZlcnNpb24+MS4wLjAtU05BUFNIT1Q8L3ZlcnNpb24+CgogIDxwcm9wZXJ0aWVzPgogICAgPGNvbXBpbGVyLXBsdWdpbi52ZXJzaW9uPjMuMTQuMTwvY29tcGlsZXItcGx1Z2luLnZlcnNpb24+CiAgICA8ZmFpbHNhZmUtcGx1Z2luLnZlcnNpb24+My41LjQ8L2ZhaWxzYWZlLXBsdWdpbi52ZXJzaW9uPgogICAgPG1hdmVuLmNvbXBpbGVyLnJlbGVhc2U+MjU8L21hdmVuLmNvbXBpbGVyLnJlbGVhc2U+CiAgICA8cHJvamVjdC5idWlsZC5zb3VyY2VFbmNvZGluZz5VVEYtODwvcHJvamVjdC5idWlsZC5zb3VyY2VFbmNvZGluZz4KICAgIDxxdWFya3VzLnBsYXRmb3JtLnZlcnNpb24+My4yNy4xPC9xdWFya3VzLnBsYXRmb3JtLnZlcnNpb24+CiAgICA8c3VyZWZpcmUtcGx1Z2luLnZlcnNpb24+My41LjQ8L3N1cmVmaXJlLXBsdWdpbi52ZXJzaW9uPgogIDwvcHJvcGVydGllcz4KCiAgPGRlcGVuZGVuY3lNYW5hZ2VtZW50PgogICAgPGRlcGVuZGVuY2llcz4KICAgICAgPGRlcGVuZGVuY3k+CiAgICAgICAgPGdyb3VwSWQ+aW8ucXVhcmt1cy5wbGF0Zm9ybTwvZ3JvdXBJZD4KICAgICAgICA8YXJ0aWZhY3RJZD5xdWFya3VzLWJvbTwvYXJ0aWZhY3RJZD4KICAgICAgICA8dmVyc2lvbj4ke3F1YXJrdXMucGxhdGZvcm0udmVyc2lvbn08L3ZlcnNpb24+CiAgICAgICAgPHR5cGU+cG9tPC90eXBlPgogICAgICAgIDxzY29wZT5pbXBvcnQ8L3Njb3BlPgogICAgICA8L2RlcGVuZGVuY3k+CiAgICA8L2RlcGVuZGVuY2llcz4KICA8L2RlcGVuZGVuY3lNYW5hZ2VtZW50PgoKICA8ZGVwZW5kZW5jaWVzPgogICAgPGRlcGVuZGVuY3k+CiAgICAgIDxncm91cElkPmlvLnF1YXJrdXM8L2dyb3VwSWQ+CiAgICAgIDxhcnRpZmFjdElkPnF1YXJrdXMtcmVzdC1qYWNrc29uPC9hcnRpZmFjdElkPgogICAgPC9kZXBlbmRlbmN5PgogICAgPGRlcGVuZGVuY3k+CiAgICAgIDxncm91cElkPmlvLnF1YXJrdXM8L2dyb3VwSWQ+CiAgICAgIDxhcnRpZmFjdElkPnF1YXJrdXMtcmVzdC1jbGllbnQtamFja3NvbjwvYXJ0aWZhY3RJZD4KICAgIDwvZGVwZW5kZW5jeT4KICAgIDxkZXBlbmRlbmN5PgogICAgICA8Z3JvdXBJZD5pby5xdWFya3VzPC9ncm91cElkPgogICAgICA8YXJ0aWZhY3RJZD5xdWFya3VzLWpkYmMtcG9zdGdyZXNxbDwvYXJ0aWZhY3RJZD4KICAgIDwvZGVwZW5kZW5jeT4KICAgIDxkZXBlbmRlbmN5PgogICAgICA8Z3JvdXBJZD5pby5xdWFya3VzPC9ncm91cElkPgogICAgICA8YXJ0aWZhY3RJZD5xdWFya3VzLWZseXdheTwvYXJ0aWZhY3RJZD4KICAgIDwvZGVwZW5kZW5jeT4KICAgIDxkZXBlbmRlbmN5PgogICAgICA8Z3JvdXBJZD5pby5xdWFya3VzPC9ncm91cElkPgogICAgICA8YXJ0aWZhY3RJZD5xdWFya3VzLXNjaGVkdWxlcjwvYXJ0aWZhY3RJZD4KICAgIDwvZGVwZW5kZW5jeT4KICAgIDxkZXBlbmRlbmN5PgogICAgICA8Z3JvdXBJZD5pby5xdWFya3VzPC9ncm91cElkPgogICAgICA8YXJ0aWZhY3RJZD5xdWFya3VzLW5hcmF5YW5hLWp0YTwvYXJ0aWZhY3RJZD4KICAgIDwvZGVwZW5kZW5jeT4KCiAgICA8ZGVwZW5kZW5jeT4KICAgICAgPGdyb3VwSWQ+aW8ucXVhcmt1czwvZ3JvdXBJZD4KICAgICAgPGFydGlmYWN0SWQ+cXVhcmt1cy1qdW5pdDU8L2FydGlmYWN0SWQ+CiAgICAgIDxzY29wZT50ZXN0PC9zY29wZT4KICAgIDwvZGVwZW5kZW5jeT4KICAgIDxkZXBlbmRlbmN5PgogICAgICA8Z3JvdXBJZD5pby5xdWFya3VzPC9ncm91cElkPgogICAgICA8YXJ0aWZhY3RJZD5xdWFya3VzLWpkYmMtaDI8L2FydGlmYWN0SWQ+CiAgICAgIDxzY29wZT50ZXN0PC9zY29wZT4KICAgIDwvZGVwZW5kZW5jeT4KICAgIDxkZXBlbmRlbmN5PgogICAgICA8Z3JvdXBJZD5pby5yZXN0LWFzc3VyZWQ8L2dyb3VwSWQ+CiAgICAgIDxhcnRpZmFjdElkPnJlc3QtYXNzdXJlZDwvYXJ0aWZhY3RJZD4KICAgICAgPHNjb3BlPnRlc3Q8L3Njb3BlPgogICAgPC9kZXBlbmRlbmN5PgogIDwvZGVwZW5kZW5jaWVzPgoKICA8YnVpbGQ+CiAgICA8cGx1Z2lucz4KICAgICAgPHBsdWdpbj4KICAgICAgICA8Z3JvdXBJZD5pby5xdWFya3VzPC9ncm91cElkPgogICAgICAgIDxhcnRpZmFjdElkPnF1YXJrdXMtbWF2ZW4tcGx1Z2luPC9hcnRpZmFjdElkPgogICAgICAgIDx2ZXJzaW9uPiR7cXVhcmt1cy5wbGF0Zm9ybS52ZXJzaW9ufTwvdmVyc2lvbj4KICAgICAgICA8ZXh0ZW5zaW9ucz50cnVlPC9leHRlbnNpb25zPgogICAgICAgIDxleGVjdXRpb25zPgogICAgICAgICAgPGV4ZWN1dGlvbj4KICAgICAgICAgICAgPGdvYWxzPgogICAgICAgICAgICAgIDxnb2FsPmJ1aWxkPC9nb2FsPgogICAgICAgICAgICAgIDxnb2FsPmdlbmVyYXRlLWNvZGU8L2dvYWw+CiAgICAgICAgICAgICAgPGdvYWw+Z2VuZXJhdGUtY29kZS10ZXN0czwvZ29hbD4KICAgICAgICAgICAgPC9nb2Fscz4KICAgICAgICAgIDwvZXhlY3V0aW9uPgogICAgICAgIDwvZXhlY3V0aW9ucz4KICAgICAgPC9wbHVnaW4+CiAgICAgIDxwbHVnaW4+CiAgICAgICAgPGFydGlmYWN0SWQ+bWF2ZW4tY29tcGlsZXItcGx1Z2luPC9hcnRpZmFjdElkPgogICAgICAgIDx2ZXJzaW9uPiR7Y29tcGlsZXItcGx1Z2luLnZlcnNpb259PC92ZXJzaW9uPgogICAgICAgIDxjb25maWd1cmF0aW9uPgogICAgICAgICAgPHBhcmFtZXRlcnM+dHJ1ZTwvcGFyYW1ldGVycz4KICAgICAgICA8L2NvbmZpZ3VyYXRpb24+CiAgICAgIDwvcGx1Z2luPgogICAgICA8cGx1Z2luPgogICAgICAgIDxhcnRpZmFjdElkPm1hdmVuLXN1cmVmaXJlLXBsdWdpbjwvYXJ0aWZhY3RJZD4KICAgICAgICA8dmVyc2lvbj4ke3N1cmVmaXJlLXBsdWdpbi52ZXJzaW9ufTwvdmVyc2lvbj4KICAgICAgICA8Y29uZmlndXJhdGlvbj4KICAgICAgICAgIDxhcmdMaW5lPi0tYWRkLW9wZW5zIGphdmEuYmFzZS9qYXZhLmxhbmc9QUxMLVVOTkFNRUQ8L2FyZ0xpbmU+CiAgICAgICAgICA8aW5jbHVkZXM+CiAgICAgICAgICAgIDxpbmNsdWRlPioqLypUZXN0LmphdmE8L2luY2x1ZGU+CiAgICAgICAgICA8L2luY2x1ZGVzPgogICAgICAgICAgPGV4Y2x1ZGVzPgogICAgICAgICAgICA8ZXhjbHVkZT4qKi8qSVQuamF2YTwvZXhjbHVkZT4KICAgICAgICAgICAgPGV4Y2x1ZGU+KiovKkFULmphdmE8L2V4Y2x1ZGU+CiAgICAgICAgICA8L2V4Y2x1ZGVzPgogICAgICAgIDwvY29uZmlndXJhdGlvbj4KICAgICAgPC9wbHVnaW4+CiAgICAgIDxwbHVnaW4+CiAgICAgICAgPGFydGlmYWN0SWQ+bWF2ZW4tZmFpbHNhZmUtcGx1Z2luPC9hcnRpZmFjdElkPgogICAgICAgIDx2ZXJzaW9uPiR7ZmFpbHNhZmUtcGx1Z2luLnZlcnNpb259PC92ZXJzaW9uPgogICAgICAgIDxjb25maWd1cmF0aW9uPgogICAgICAgICAgPGFyZ0xpbmU+LS1hZGQtb3BlbnMgamF2YS5iYXNlL2phdmEubGFuZz1BTEwtVU5OQU1FRDwvYXJnTGluZT4KICAgICAgICAgIDxpbmNsdWRlcz4KICAgICAgICAgICAgPGluY2x1ZGU+KiovKklULmphdmE8L2luY2x1ZGU+CiAgICAgICAgICAgIDxpbmNsdWRlPioqLypBVC5qYXZhPC9pbmNsdWRlPgogICAgICAgICAgPC9pbmNsdWRlcz4KICAgICAgICA8L2NvbmZpZ3VyYXRpb24+CiAgICAgICAgPGV4ZWN1dGlvbnM+CiAgICAgICAgICA8ZXhlY3V0aW9uPgogICAgICAgICAgICA8Z29hbHM+CiAgICAgICAgICAgICAgPGdvYWw+aW50ZWdyYXRpb24tdGVzdDwvZ29hbD4KICAgICAgICAgICAgICA8Z29hbD52ZXJpZnk8L2dvYWw+CiAgICAgICAgICAgIDwvZ29hbHM+CiAgICAgICAgICA8L2V4ZWN1dGlvbj4KICAgICAgICA8L2V4ZWN1dGlvbnM+CiAgICAgIDwvcGx1Z2luPgogICAgPC9wbHVnaW5zPgogIDwvYnVpbGQ+CjwvcHJvamVjdD4K",
    "file_count": 14
  }
}
