{
  "efficiency": {
    "wall_clock_s": 240,
    "active_agent_s": 225,
    "tokens_in": 205000,
    "tokens_out": 13000,
    "tokens_total": 218000,
    "cost_usd": 4.05
  },
  "outcome_quality": {
    "acceptance_pass": true,
    "acceptance_coverage": 1.0,
    "rework_turns": 1,
    "artifact_completeness": 1.0
  },
  "protocol_labels": {
    "scenario": "scenario3",
    "case_id": "case-3-current-openspec-problem2",
    "tool": "claude-code",
    "model": "claude-opus-5",
    "plinth_config": "openspec-only",
    "commit": "bd6e85085e1918af0e8f6d08958ee8f6fd56f05e",
    "retry_count": 0,
    "human_intervention_min": 0
  },
  "plinth_usage": {
    "skills_count": 1,
    "commands_count": 0,
    "agents_count": 0,
    "skills": ["openspec-propose"],
    "commands": [],
    "agents": []
  },
  "solution_snapshot": {
    "demo_root": "benchmarks/problem2/scenario3/demo/",
    "tree_format": "unix-tree",
    "tree_encoding": "base64",
    "tree_b64": "YmVuY2htYXJrcy9wcm9ibGVtMi9zY2VuYXJpbzMvZGVtby8K4pSc4pSA4pSAIC5naXRrZWVwCuKUnOKUgOKUgCBwb20ueG1sCuKUlOKUgOKUgCBzcmMKICAgIOKUnOKUgOKUgCBtYWluCiAgICDilILCoMKgIOKUnOKUgOKUgCBqYXZhCiAgICDilILCoMKgIOKUgsKgwqAg4pSU4pSA4pSAIGluZm8KICAgIOKUgsKgwqAg4pSCwqDCoCAgICAg4pSU4pSA4pSAIGphYgogICAg4pSCwqDCoCDilILCoMKgICAgICAgICAg4pSU4pSA4pSAIHBsaW50aAogICAg4pSCwqDCoCDilILCoMKgICAgICAgICAgICAgIOKUlOKUgOKUgCBnb2RzCiAgICDilILCoMKgIOKUgsKgwqAgICAgICAgICAgICAgICAgIOKUnOKUgOKUgCBHb2RVcGRhdGVyLmphdmEKICAgIOKUgsKgwqAg4pSCwqDCoCAgICAgICAgICAgICAgICAg4pSc4pSA4pSAIEdyZWVrR29kLmphdmEKICAgIOKUgsKgwqAg4pSCwqDCoCAgICAgICAgICAgICAgICAg4pSc4pSA4pSAIEdyZWVrR29kUmVwb3NpdG9yeS5qYXZhCiAgICDilILCoMKgIOKUgsKgwqAgICAgICAgICAgICAgICAgIOKUnOKUgOKUgCBHcmVla0dvZFJlc291cmNlLmphdmEKICAgIOKUgsKgwqAg4pSCwqDCoCAgICAgICAgICAgICAgICAg4pSc4pSA4pSAIEdyZWVrR29kU2VydmljZS5qYXZhCiAgICDilILCoMKgIOKUgsKgwqAgICAgICAgICAgICAgICAgIOKUlOKUgOKUgCBHcmVla0dvZHNTb3VyY2VDbGllbnQuamF2YQogICAg4pSCwqDCoCDilJTilIDilIAgcmVzb3VyY2VzCiAgICDilILCoMKgICAgICDilJzilIDilIAgYXBwbGljYXRpb24ucHJvcGVydGllcwogICAg4pSCwqDCoCAgICAg4pSU4pSA4pSAIGRiCiAgICDilILCoMKgICAgICAgICAg4pSU4pSA4pSAIG1pZ3JhdGlvbgogICAg4pSCwqDCoCAgICAgICAgICAgICDilJTilIDilIAgVjFfX2NyZWF0ZV9ncmVla19nb2Quc3FsCiAgICDilJTilIDilIAgdGVzdAogICAgICAgIOKUnOKUgOKUgCBqYXZhCiAgICAgICAg4pSCwqDCoCDilJTilIDilIAgaW5mbwogICAgICAgIOKUgsKgwqAgICAgIOKUlOKUgOKUgCBqYWIKICAgICAgICDilILCoMKgICAgICAgICAg4pSU4pSA4pSAIHBsaW50aAogICAgICAgIOKUgsKgwqAgICAgICAgICAgICAg4pSU4pSA4pSAIGdvZHMKICAgICAgICDilILCoMKgICAgICAgICAgICAgICAgICDilJzilIDilIAgR29kVXBkYXRlclRlc3QuamF2YQogICAgICAgIOKUgsKgwqAgICAgICAgICAgICAgICAgIOKUnOKUgOKUgCBHcmVla0dvZFJlc291cmNlRXJyb3JUZXN0LmphdmEKICAgICAgICDilILCoMKgICAgICAgICAgICAgICAgICDilJzilIDilIAgR3JlZWtHb2RSZXNvdXJjZVRlc3QuamF2YQogICAgICAgIOKUgsKgwqAgICAgICAgICAgICAgICAgIOKUnOKUgOKUgCBHcmVla0dvZHNTb3VyY2VTdHViLmphdmEKICAgICAgICDilILCoMKgICAgICAgICAgICAgICAgICDilJTilIDilIAgR3JlZWtHb2RUZXN0RGF0YS5qYXZhCiAgICAgICAg4pSU4pSA4pSAIHJlc291cmNlcwogICAgICAgICAgICDilJTilIDilIAgYXBwbGljYXRpb24ucHJvcGVydGllcwoKMTggZGlyZWN0b3JpZXMsIDE2IGZpbGVzCg==",
    "pom_xml_b64": "PD94bWwgdmVyc2lvbj0iMS4wIiBlbmNvZGluZz0iVVRGLTgiPz4KPHByb2plY3QgeG1sbnM9Imh0dHA6Ly9tYXZlbi5hcGFjaGUub3JnL1BPTS80LjAuMCIKICAgICAgICAgeG1sbnM6eHNpPSJodHRwOi8vd3d3LnczLm9yZy8yMDAxL1hNTFNjaGVtYS1pbnN0YW5jZSIKICAgICAgICAgeHNpOnNjaGVtYUxvY2F0aW9uPSJodHRwOi8vbWF2ZW4uYXBhY2hlLm9yZy9QT00vNC4wLjAgaHR0cHM6Ly9tYXZlbi5hcGFjaGUub3JnL3hzZC9tYXZlbi00LjAuMC54c2QiPgogIDxtb2RlbFZlcnNpb24+NC4wLjA8L21vZGVsVmVyc2lvbj4KCiAgPGdyb3VwSWQ+aW5mby5qYWIucGxpbnRoPC9ncm91cElkPgogIDxhcnRpZmFjdElkPmdyZWVrLWdvZHMtYXBpPC9hcnRpZmFjdElkPgogIDx2ZXJzaW9uPjEuMC4wLVNOQVBTSE9UPC92ZXJzaW9uPgogIDxwYWNrYWdpbmc+amFyPC9wYWNrYWdpbmc+CiAgPG5hbWU+Z3JlZWstZ29kcy1hcGk8L25hbWU+CgogIDxwcm9wZXJ0aWVzPgogICAgPHByb2plY3QuYnVpbGQuc291cmNlRW5jb2Rpbmc+VVRGLTg8L3Byb2plY3QuYnVpbGQuc291cmNlRW5jb2Rpbmc+CiAgICA8bWF2ZW4uY29tcGlsZXIucmVsZWFzZT4yMTwvbWF2ZW4uY29tcGlsZXIucmVsZWFzZT4KICAgIDxxdWFya3VzLnBsYXRmb3JtLmdyb3VwLWlkPmlvLnF1YXJrdXMucGxhdGZvcm08L3F1YXJrdXMucGxhdGZvcm0uZ3JvdXAtaWQ+CiAgICA8cXVhcmt1cy5wbGF0Zm9ybS5hcnRpZmFjdC1pZD5xdWFya3VzLWJvbTwvcXVhcmt1cy5wbGF0Zm9ybS5hcnRpZmFjdC1pZD4KICAgIDxxdWFya3VzLnBsYXRmb3JtLnZlcnNpb24+My4zOC4yPC9xdWFya3VzLnBsYXRmb3JtLnZlcnNpb24+CiAgICA8c3VyZWZpcmUtcGx1Z2luLnZlcnNpb24+My41LjI8L3N1cmVmaXJlLXBsdWdpbi52ZXJzaW9uPgogIDwvcHJvcGVydGllcz4KCiAgPGRlcGVuZGVuY3lNYW5hZ2VtZW50PgogICAgPGRlcGVuZGVuY2llcz4KICAgICAgPGRlcGVuZGVuY3k+CiAgICAgICAgPGdyb3VwSWQ+JHtxdWFya3VzLnBsYXRmb3JtLmdyb3VwLWlkfTwvZ3JvdXBJZD4KICAgICAgICA8YXJ0aWZhY3RJZD4ke3F1YXJrdXMucGxhdGZvcm0uYXJ0aWZhY3QtaWR9PC9hcnRpZmFjdElkPgogICAgICAgIDx2ZXJzaW9uPiR7cXVhcmt1cy5wbGF0Zm9ybS52ZXJzaW9ufTwvdmVyc2lvbj4KICAgICAgICA8dHlwZT5wb208L3R5cGU+CiAgICAgICAgPHNjb3BlPmltcG9ydDwvc2NvcGU+CiAgICAgIDwvZGVwZW5kZW5jeT4KICAgIDwvZGVwZW5kZW5jaWVzPgogIDwvZGVwZW5kZW5jeU1hbmFnZW1lbnQ+CgogIDxkZXBlbmRlbmNpZXM+CiAgICA8ZGVwZW5kZW5jeT4KICAgICAgPGdyb3VwSWQ+aW8ucXVhcmt1czwvZ3JvdXBJZD4KICAgICAgPGFydGlmYWN0SWQ+cXVhcmt1cy1yZXN0LWphY2tzb248L2FydGlmYWN0SWQ+CiAgICA8L2RlcGVuZGVuY3k+CiAgICA8ZGVwZW5kZW5jeT4KICAgICAgPGdyb3VwSWQ+aW8ucXVhcmt1czwvZ3JvdXBJZD4KICAgICAgPGFydGlmYWN0SWQ+cXVhcmt1cy1yZXN0LWNsaWVudC1qYWNrc29uPC9hcnRpZmFjdElkPgogICAgPC9kZXBlbmRlbmN5PgogICAgPGRlcGVuZGVuY3k+CiAgICAgIDxncm91cElkPmlvLnF1YXJrdXM8L2dyb3VwSWQ+CiAgICAgIDxhcnRpZmFjdElkPnF1YXJrdXMtc21hbGxyeWUtb3BlbmFwaTwvYXJ0aWZhY3RJZD4KICAgIDwvZGVwZW5kZW5jeT4KICAgIDxkZXBlbmRlbmN5PgogICAgICA8Z3JvdXBJZD5pby5xdWFya3VzPC9ncm91cElkPgogICAgICA8YXJ0aWZhY3RJZD5xdWFya3VzLWFncm9hbDwvYXJ0aWZhY3RJZD4KICAgIDwvZGVwZW5kZW5jeT4KICAgIDxkZXBlbmRlbmN5PgogICAgICA8Z3JvdXBJZD5pby5xdWFya3VzPC9ncm91cElkPgogICAgICA8YXJ0aWZhY3RJZD5xdWFya3VzLWpkYmMtcG9zdGdyZXNxbDwvYXJ0aWZhY3RJZD4KICAgIDwvZGVwZW5kZW5jeT4KICAgIDxkZXBlbmRlbmN5PgogICAgICA8Z3JvdXBJZD5pby5xdWFya3VzPC9ncm91cElkPgogICAgICA8YXJ0aWZhY3RJZD5xdWFya3VzLWZseXdheTwvYXJ0aWZhY3RJZD4KICAgIDwvZGVwZW5kZW5jeT4KICAgIDxkZXBlbmRlbmN5PgogICAgICA8Z3JvdXBJZD5pby5xdWFya3VzPC9ncm91cElkPgogICAgICA8YXJ0aWZhY3RJZD5xdWFya3VzLXNjaGVkdWxlcjwvYXJ0aWZhY3RJZD4KICAgIDwvZGVwZW5kZW5jeT4KICAgIDxkZXBlbmRlbmN5PgogICAgICA8Z3JvdXBJZD5pby5xdWFya3VzPC9ncm91cElkPgogICAgICA8YXJ0aWZhY3RJZD5xdWFya3VzLWFyYzwvYXJ0aWZhY3RJZD4KICAgIDwvZGVwZW5kZW5jeT4KCiAgICA8ZGVwZW5kZW5jeT4KICAgICAgPGdyb3VwSWQ+aW8ucXVhcmt1czwvZ3JvdXBJZD4KICAgICAgPGFydGlmYWN0SWQ+cXVhcmt1cy1qdW5pdDU8L2FydGlmYWN0SWQ+CiAgICAgIDxzY29wZT50ZXN0PC9zY29wZT4KICAgIDwvZGVwZW5kZW5jeT4KICAgIDxkZXBlbmRlbmN5PgogICAgICA8Z3JvdXBJZD5pby5xdWFya3VzPC9ncm91cElkPgogICAgICA8YXJ0aWZhY3RJZD5xdWFya3VzLWp1bml0NS1tb2NraXRvPC9hcnRpZmFjdElkPgogICAgICA8c2NvcGU+dGVzdDwvc2NvcGU+CiAgICA8L2RlcGVuZGVuY3k+CiAgICA8ZGVwZW5kZW5jeT4KICAgICAgPGdyb3VwSWQ+aW8ucmVzdC1hc3N1cmVkPC9ncm91cElkPgogICAgICA8YXJ0aWZhY3RJZD5yZXN0LWFzc3VyZWQ8L2FydGlmYWN0SWQ+CiAgICAgIDxzY29wZT50ZXN0PC9zY29wZT4KICAgIDwvZGVwZW5kZW5jeT4KICAgIDxkZXBlbmRlbmN5PgogICAgICA8Z3JvdXBJZD5vcmcuYXNzZXJ0ajwvZ3JvdXBJZD4KICAgICAgPGFydGlmYWN0SWQ+YXNzZXJ0ai1jb3JlPC9hcnRpZmFjdElkPgogICAgICA8dmVyc2lvbj4zLjI3LjY8L3ZlcnNpb24+CiAgICAgIDxzY29wZT50ZXN0PC9zY29wZT4KICAgIDwvZGVwZW5kZW5jeT4KICA8L2RlcGVuZGVuY2llcz4KCiAgPGJ1aWxkPgogICAgPHBsdWdpbnM+CiAgICAgIDxwbHVnaW4+CiAgICAgICAgPGdyb3VwSWQ+JHtxdWFya3VzLnBsYXRmb3JtLmdyb3VwLWlkfTwvZ3JvdXBJZD4KICAgICAgICA8YXJ0aWZhY3RJZD5xdWFya3VzLW1hdmVuLXBsdWdpbjwvYXJ0aWZhY3RJZD4KICAgICAgICA8dmVyc2lvbj4ke3F1YXJrdXMucGxhdGZvcm0udmVyc2lvbn08L3ZlcnNpb24+CiAgICAgICAgPGV4dGVuc2lvbnM+dHJ1ZTwvZXh0ZW5zaW9ucz4KICAgICAgICA8ZXhlY3V0aW9ucz4KICAgICAgICAgIDxleGVjdXRpb24+CiAgICAgICAgICAgIDxnb2Fscz4KICAgICAgICAgICAgICA8Z29hbD5idWlsZDwvZ29hbD4KICAgICAgICAgICAgICA8Z29hbD5nZW5lcmF0ZS1jb2RlPC9nb2FsPgogICAgICAgICAgICAgIDxnb2FsPmdlbmVyYXRlLWNvZGUtdGVzdHM8L2dvYWw+CiAgICAgICAgICAgIDwvZ29hbHM+CiAgICAgICAgICA8L2V4ZWN1dGlvbj4KICAgICAgICA8L2V4ZWN1dGlvbnM+CiAgICAgIDwvcGx1Z2luPgogICAgICA8cGx1Z2luPgogICAgICAgIDxncm91cElkPm9yZy5hcGFjaGUubWF2ZW4ucGx1Z2luczwvZ3JvdXBJZD4KICAgICAgICA8YXJ0aWZhY3RJZD5tYXZlbi1zdXJlZmlyZS1wbHVnaW48L2FydGlmYWN0SWQ+CiAgICAgICAgPHZlcnNpb24+JHtzdXJlZmlyZS1wbHVnaW4udmVyc2lvbn08L3ZlcnNpb24+CiAgICAgICAgPGNvbmZpZ3VyYXRpb24+CiAgICAgICAgICA8c3lzdGVtUHJvcGVydHlWYXJpYWJsZXM+CiAgICAgICAgICAgIDxqYXZhLnV0aWwubG9nZ2luZy5tYW5hZ2VyPm9yZy5qYm9zcy5sb2dtYW5hZ2VyLkxvZ01hbmFnZXI8L2phdmEudXRpbC5sb2dnaW5nLm1hbmFnZXI+CiAgICAgICAgICAgIDxtYXZlbi5ob21lPiR7bWF2ZW4uaG9tZX08L21hdmVuLmhvbWU+CiAgICAgICAgICA8L3N5c3RlbVByb3BlcnR5VmFyaWFibGVzPgogICAgICAgIDwvY29uZmlndXJhdGlvbj4KICAgICAgPC9wbHVnaW4+CiAgICA8L3BsdWdpbnM+CiAgPC9idWlsZD4KPC9wcm9qZWN0Pgo=",
    "file_count": 15
  }
}
