{
  "efficiency": {
    "wall_clock_s": 230.0,
    "active_agent_s": 210.0,
    "tokens_in": 0,
    "tokens_out": 0,
    "tokens_total": 0,
    "cost_usd": 0.0
  },
  "outcome_quality": {
    "acceptance_pass": true,
    "acceptance_coverage": 1.0,
    "rework_turns": 1,
    "artifact_completeness": 1.0
  },
  "protocol_labels": {
    "scenario": "scenario1",
    "case_id": "case-1-readme-only",
    "tool": "cursor",
    "model": "cursor-grok-4.5",
    "plinth_config": "bare-agent",
    "commit": "151f7d33f293c912ee85516fc023d6ae9dc676f1",
    "retry_count": 1,
    "human_intervention_min": 0
  },
  "plinth_usage": {
    "skills_count": 4,
    "commands_count": 0,
    "agents_count": 0,
    "skills": [
      "300-frameworks-spring-boot-create-project",
      "302-frameworks-spring-boot-rest",
      "311-frameworks-spring-jdbc",
      "323-frameworks-spring-boot-testing-acceptance-tests"
    ],
    "commands": [],
    "agents": []
  },
  "solution_snapshot": {
    "demo_root": "benchmarks/problem2/scenario1/demo/",
    "tree_format": "unix-tree",
    "tree_encoding": "base64",
    "tree_b64": "YmVuY2htYXJrcy9wcm9ibGVtMi9zY2VuYXJpbzEvZGVtby8K4pSc4pSA4pSAIC5naXRhdHRyaWJ1dGVzCuKUnOKUgOKUgCAuZ2l0aWdub3JlCuKUnOKUgOKUgCAubXZuCuKUgsKgwqAg4pSU4pSA4pSAIHdyYXBwZXIK4pSCwqDCoCAgICAg4pSU4pSA4pSAIG1hdmVuLXdyYXBwZXIucHJvcGVydGllcwrilJzilIDilIAgSEVMUC5tZArilJzilIDilIAgbXZudwrilJzilIDilIAgbXZudy5jbWQK4pSc4pSA4pSAIHBvbS54bWwK4pSU4pSA4pSAIHNyYwogICAg4pSc4pSA4pSAIG1haW4KICAgIOKUgsKgwqAg4pSc4pSA4pSAIGphdmEKICAgIOKUgsKgwqAg4pSCwqDCoCDilJTilIDilIAgaW5mbwogICAg4pSCwqDCoCDilILCoMKgICAgICDilJTilIDilIAgamFiCiAgICDilILCoMKgIOKUgsKgwqAgICAgICAgICDilJTilIDilIAgbXMKICAgIOKUgsKgwqAg4pSCwqDCoCAgICAgICAgICAgICDilJzilIDilIAgR3JlZWtHb2RzQXBpQXBwbGljYXRpb24uamF2YQogICAg4pSCwqDCoCDilILCoMKgICAgICAgICAgICAgIOKUnOKUgOKUgCBjbGllbnQKICAgIOKUgsKgwqAg4pSCwqDCoCAgICAgICAgICAgICDilILCoMKgIOKUlOKUgOKUgCBFeHRlcm5hbEdyZWVrR29kc0NsaWVudC5qYXZhCiAgICDilILCoMKgIOKUgsKgwqAgICAgICAgICAgICAg4pSc4pSA4pSAIGNvbmZpZwogICAg4pSCwqDCoCDilILCoMKgICAgICAgICAgICAgIOKUgsKgwqAg4pSc4pSA4pSAIEdyZWVrR29kc1Byb3BlcnRpZXMuamF2YQogICAg4pSCwqDCoCDilILCoMKgICAgICAgICAgICAgIOKUgsKgwqAg4pSc4pSA4pSAIFJlc3RDbGllbnRDb25maWcuamF2YQogICAg4pSCwqDCoCDilILCoMKgICAgICAgICAgICAgIOKUgsKgwqAg4pSU4pSA4pSAIFN5bmNTdGFydHVwQ29uZmlnLmphdmEKICAgIOKUgsKgwqAg4pSCwqDCoCAgICAgICAgICAgICDilJzilIDilIAgZG9tYWluCiAgICDilILCoMKgIOKUgsKgwqAgICAgICAgICAgICAg4pSCwqDCoCDilJTilIDilIAgR3JlZWtHb2QuamF2YQogICAg4pSCwqDCoCDilILCoMKgICAgICAgICAgICAgIOKUnOKUgOKUgCByZXBvc2l0b3J5CiAgICDilILCoMKgIOKUgsKgwqAgICAgICAgICAgICAg4pSCwqDCoCDilJTilIDilIAgR3JlZWtHb2RSZXBvc2l0b3J5LmphdmEKICAgIOKUgsKgwqAg4pSCwqDCoCAgICAgICAgICAgICDilJzilIDilIAgc2VydmljZQogICAg4pSCwqDCoCDilILCoMKgICAgICAgICAgICAgIOKUgsKgwqAg4pSc4pSA4pSAIEdyZWVrR29kUXVlcnlTZXJ2aWNlLmphdmEKICAgIOKUgsKgwqAg4pSCwqDCoCAgICAgICAgICAgICDilILCoMKgIOKUlOKUgOKUgCBHcmVla0dvZFN5bmNTZXJ2aWNlLmphdmEKICAgIOKUgsKgwqAg4pSCwqDCoCAgICAgICAgICAgICDilJTilIDilIAgd2ViCiAgICDilILCoMKgIOKUgsKgwqAgICAgICAgICAgICAgICAgIOKUlOKUgOKUgCBHcmVla0dvZENvbnRyb2xsZXIuamF2YQogICAg4pSCwqDCoCDilJTilIDilIAgcmVzb3VyY2VzCiAgICDilILCoMKgICAgICDilJzilIDilIAgYXBwbGljYXRpb24ucHJvcGVydGllcwogICAg4pSCwqDCoCAgICAg4pSc4pSA4pSAIHNjaGVtYS5zcWwKICAgIOKUgsKgwqAgICAgIOKUnOKUgOKUgCBzdGF0aWMKICAgIOKUgsKgwqAgICAgIOKUlOKUgOKUgCB0ZW1wbGF0ZXMKICAgIOKUlOKUgOKUgCB0ZXN0CiAgICAgICAg4pSU4pSA4pSAIGphdmEKICAgICAgICAgICAg4pSU4pSA4pSAIGluZm8KICAgICAgICAgICAgICAgIOKUlOKUgOKUgCBqYWIKICAgICAgICAgICAgICAgICAgICDilJTilIDilIAgbXMKICAgICAgICAgICAgICAgICAgICAgICAg4pSc4pSA4pSAIEdyZWVrR29kc0FwaUFwcGxpY2F0aW9uVGVzdHMuamF2YQogICAgICAgICAgICAgICAgICAgICAgICDilJTilIDilIAgR3JlZWtHb2RzSGFwcHlQYXRoQVQuamF2YQoKMjMgZGlyZWN0b3JpZXMsIDIxIGZpbGVzCg==",
    "pom_xml_b64": "PD94bWwgdmVyc2lvbj0iMS4wIiBlbmNvZGluZz0iVVRGLTgiPz4KPHByb2plY3QgeG1sbnM9Imh0dHA6Ly9tYXZlbi5hcGFjaGUub3JnL1BPTS80LjAuMCIgeG1sbnM6eHNpPSJodHRwOi8vd3d3LnczLm9yZy8yMDAxL1hNTFNjaGVtYS1pbnN0YW5jZSIKCXhzaTpzY2hlbWFMb2NhdGlvbj0iaHR0cDovL21hdmVuLmFwYWNoZS5vcmcvUE9NLzQuMC4wIGh0dHBzOi8vbWF2ZW4uYXBhY2hlLm9yZy94c2QvbWF2ZW4tNC4wLjAueHNkIj4KCTxtb2RlbFZlcnNpb24+NC4wLjA8L21vZGVsVmVyc2lvbj4KCTxwYXJlbnQ+CgkJPGdyb3VwSWQ+b3JnLnNwcmluZ2ZyYW1ld29yay5ib290PC9ncm91cElkPgoJCTxhcnRpZmFjdElkPnNwcmluZy1ib290LXN0YXJ0ZXItcGFyZW50PC9hcnRpZmFjdElkPgoJCTx2ZXJzaW9uPjQuMC41PC92ZXJzaW9uPgoJCTxyZWxhdGl2ZVBhdGgvPgoJPC9wYXJlbnQ+Cgk8Z3JvdXBJZD5pbmZvLmphYi5wbGludGg8L2dyb3VwSWQ+Cgk8YXJ0aWZhY3RJZD5ncmVlay1nb2RzLWFwaTwvYXJ0aWZhY3RJZD4KCTx2ZXJzaW9uPjAuMC4xLVNOQVBTSE9UPC92ZXJzaW9uPgoJPG5hbWU+Z3JlZWstZ29kcy1hcGk8L25hbWU+Cgk8ZGVzY3JpcHRpb24+R3JlZWsgR29kcyBBUEkg4oCUIFNjZW5hcmlvIDEgQ2FzZSAxIGJlbmNobWFyayBkZW1vPC9kZXNjcmlwdGlvbj4KCTxwcm9wZXJ0aWVzPgoJCTxqYXZhLnZlcnNpb24+MjU8L2phdmEudmVyc2lvbj4KCTwvcHJvcGVydGllcz4KCTxkZXBlbmRlbmNpZXM+CgkJPGRlcGVuZGVuY3k+CgkJCTxncm91cElkPm9yZy5zcHJpbmdmcmFtZXdvcmsuYm9vdDwvZ3JvdXBJZD4KCQkJPGFydGlmYWN0SWQ+c3ByaW5nLWJvb3Qtc3RhcnRlci1qZGJjPC9hcnRpZmFjdElkPgoJCTwvZGVwZW5kZW5jeT4KCQk8ZGVwZW5kZW5jeT4KCQkJPGdyb3VwSWQ+b3JnLnNwcmluZ2ZyYW1ld29yay5ib290PC9ncm91cElkPgoJCQk8YXJ0aWZhY3RJZD5zcHJpbmctYm9vdC1zdGFydGVyLXZhbGlkYXRpb248L2FydGlmYWN0SWQ+CgkJPC9kZXBlbmRlbmN5PgoJCTxkZXBlbmRlbmN5PgoJCQk8Z3JvdXBJZD5vcmcuc3ByaW5nZnJhbWV3b3JrLmJvb3Q8L2dyb3VwSWQ+CgkJCTxhcnRpZmFjdElkPnNwcmluZy1ib290LXN0YXJ0ZXItd2VibXZjPC9hcnRpZmFjdElkPgoJCTwvZGVwZW5kZW5jeT4KCgkJPGRlcGVuZGVuY3k+CgkJCTxncm91cElkPm9yZy5zcHJpbmdmcmFtZXdvcmsuYm9vdDwvZ3JvdXBJZD4KCQkJPGFydGlmYWN0SWQ+c3ByaW5nLWJvb3Qtc3RhcnRlci1yZXN0Y2xpZW50PC9hcnRpZmFjdElkPgoJCTwvZGVwZW5kZW5jeT4KCQk8ZGVwZW5kZW5jeT4KCQkJPGdyb3VwSWQ+Y29tLmgyZGF0YWJhc2U8L2dyb3VwSWQ+CgkJCTxhcnRpZmFjdElkPmgyPC9hcnRpZmFjdElkPgoJCQk8c2NvcGU+cnVudGltZTwvc2NvcGU+CgkJPC9kZXBlbmRlbmN5PgoJCTxkZXBlbmRlbmN5PgoJCQk8Z3JvdXBJZD5vcmcuc3ByaW5nZnJhbWV3b3JrLmJvb3Q8L2dyb3VwSWQ+CgkJCTxhcnRpZmFjdElkPnNwcmluZy1ib290LXN0YXJ0ZXItamRiYy10ZXN0PC9hcnRpZmFjdElkPgoJCQk8c2NvcGU+dGVzdDwvc2NvcGU+CgkJPC9kZXBlbmRlbmN5PgoJCTxkZXBlbmRlbmN5PgoJCQk8Z3JvdXBJZD5vcmcuc3ByaW5nZnJhbWV3b3JrLmJvb3Q8L2dyb3VwSWQ+CgkJCTxhcnRpZmFjdElkPnNwcmluZy1ib290LXN0YXJ0ZXItdmFsaWRhdGlvbi10ZXN0PC9hcnRpZmFjdElkPgoJCQk8c2NvcGU+dGVzdDwvc2NvcGU+CgkJPC9kZXBlbmRlbmN5PgoJCTxkZXBlbmRlbmN5PgoJCQk8Z3JvdXBJZD5vcmcuc3ByaW5nZnJhbWV3b3JrLmJvb3Q8L2dyb3VwSWQ+CgkJCTxhcnRpZmFjdElkPnNwcmluZy1ib290LXN0YXJ0ZXItd2VibXZjLXRlc3Q8L2FydGlmYWN0SWQ+CgkJCTxzY29wZT50ZXN0PC9zY29wZT4KCQk8L2RlcGVuZGVuY3k+CgkJPGRlcGVuZGVuY3k+CgkJCTxncm91cElkPm9yZy5zcHJpbmdmcmFtZXdvcmsuYm9vdDwvZ3JvdXBJZD4KCQkJPGFydGlmYWN0SWQ+c3ByaW5nLWJvb3QtcmVzdHRlc3RjbGllbnQ8L2FydGlmYWN0SWQ+CgkJCTxzY29wZT50ZXN0PC9zY29wZT4KCQk8L2RlcGVuZGVuY3k+CgkJPGRlcGVuZGVuY3k+CgkJCTxncm91cElkPm9yZy53aXJlbW9jazwvZ3JvdXBJZD4KCQkJPGFydGlmYWN0SWQ+d2lyZW1vY2stc3RhbmRhbG9uZTwvYXJ0aWZhY3RJZD4KCQkJPHZlcnNpb24+My4xMy4xPC92ZXJzaW9uPgoJCQk8c2NvcGU+dGVzdDwvc2NvcGU+CgkJPC9kZXBlbmRlbmN5PgoJPC9kZXBlbmRlbmNpZXM+Cgk8YnVpbGQ+CgkJPHBsdWdpbnM+CgkJCTxwbHVnaW4+CgkJCQk8Z3JvdXBJZD5vcmcuc3ByaW5nZnJhbWV3b3JrLmJvb3Q8L2dyb3VwSWQ+CgkJCQk8YXJ0aWZhY3RJZD5zcHJpbmctYm9vdC1tYXZlbi1wbHVnaW48L2FydGlmYWN0SWQ+CgkJCTwvcGx1Z2luPgoJCQk8cGx1Z2luPgoJCQkJPGdyb3VwSWQ+b3JnLmFwYWNoZS5tYXZlbi5wbHVnaW5zPC9ncm91cElkPgoJCQkJPGFydGlmYWN0SWQ+bWF2ZW4tc3VyZWZpcmUtcGx1Z2luPC9hcnRpZmFjdElkPgoJCQkJPGNvbmZpZ3VyYXRpb24+CgkJCQkJPGV4Y2x1ZGVzPgoJCQkJCQk8ZXhjbHVkZT4qKi8qQVQuamF2YTwvZXhjbHVkZT4KCQkJCQk8L2V4Y2x1ZGVzPgoJCQkJPC9jb25maWd1cmF0aW9uPgoJCQk8L3BsdWdpbj4KCQkJPHBsdWdpbj4KCQkJCTxncm91cElkPm9yZy5hcGFjaGUubWF2ZW4ucGx1Z2luczwvZ3JvdXBJZD4KCQkJCTxhcnRpZmFjdElkPm1hdmVuLWZhaWxzYWZlLXBsdWdpbjwvYXJ0aWZhY3RJZD4KCQkJCTxleGVjdXRpb25zPgoJCQkJCTxleGVjdXRpb24+CgkJCQkJCTxnb2Fscz4KCQkJCQkJCTxnb2FsPmludGVncmF0aW9uLXRlc3Q8L2dvYWw+CgkJCQkJCQk8Z29hbD52ZXJpZnk8L2dvYWw+CgkJCQkJCTwvZ29hbHM+CgkJCQkJPC9leGVjdXRpb24+CgkJCQk8L2V4ZWN1dGlvbnM+CgkJCQk8Y29uZmlndXJhdGlvbj4KCQkJCQk8aW5jbHVkZXM+CgkJCQkJCTxpbmNsdWRlPioqLypBVC5qYXZhPC9pbmNsdWRlPgoJCQkJCTwvaW5jbHVkZXM+CgkJCQk8L2NvbmZpZ3VyYXRpb24+CgkJCTwvcGx1Z2luPgoJCTwvcGx1Z2lucz4KCTwvYnVpbGQ+CjwvcHJvamVjdD4K",
    "file_count": 21
  }
}
