{
  "efficiency": {
    "wall_clock_s": 420.0,
    "active_agent_s": 346.0,
    "tokens_in": 245000,
    "tokens_out": 15000,
    "tokens_total": 260000,
    "cost_usd": 1.61
  },
  "outcome_quality": {
    "acceptance_pass": true,
    "acceptance_coverage": 1.0,
    "rework_turns": 3,
    "artifact_completeness": 1.0
  },
  "protocol_labels": {
    "scenario": "scenario1",
    "case_id": "case-1-readme-only",
    "tool": "claude-code",
    "model": "claude-opus-5",
    "plinth_config": "full-plinth",
    "commit": "5bcd3af4bc7a01a3ce6d435b57a2a11f3a034087",
    "retry_count": 0,
    "human_intervention_min": 0
  },
  "plinth_usage": {
    "skills_count": 4,
    "commands_count": 0,
    "agents_count": 0,
    "skills": [
      "300-frameworks-spring-boot-create-project",
      "302-frameworks-spring-boot-rest",
      "312-frameworks-spring-data-jdbc",
      "323-frameworks-spring-boot-testing-acceptance-tests"
    ],
    "commands": [],
    "agents": []
  },
  "solution_snapshot": {
    "demo_root": "benchmarks/problem2/scenario1/demo/",
    "tree_format": "unix-tree",
    "tree_encoding": "base64",
    "tree_b64": "YmVuY2htYXJrcy9wcm9ibGVtMi9zY2VuYXJpbzEvZGVtby8K4pSc4pSA4pSAIC5naXRrZWVwCuKUnOKUgOKUgCAubXZuCuKUgsKgwqAg4pSc4pSA4pSAIGp2bS5jb25maWcK4pSCwqDCoCDilJTilIDilIAgd3JhcHBlcgrilILCoMKgICAgICDilJzilIDilIAgbWF2ZW4td3JhcHBlci5qYXIK4pSCwqDCoCAgICAg4pSU4pSA4pSAIG1hdmVuLXdyYXBwZXIucHJvcGVydGllcwrilJzilIDilIAgbXZudwrilJzilIDilIAgbXZudy5jbWQK4pSc4pSA4pSAIHBvbS54bWwK4pSc4pSA4pSAIFJFQURNRS5tZArilJTilIDilIAgc3JjCiAgICDilJzilIDilIAgbWFpbgogICAg4pSCwqDCoCDilJzilIDilIAgamF2YQogICAg4pSCwqDCoCDilILCoMKgIOKUlOKUgOKUgCBpbmZvCiAgICDilILCoMKgIOKUgsKgwqAgICAgIOKUlOKUgOKUgCBqYWIKICAgIOKUgsKgwqAg4pSCwqDCoCAgICAgICAgIOKUlOKUgOKUgCBwbGludGgKICAgIOKUgsKgwqAg4pSCwqDCoCAgICAgICAgICAgICDilJTilIDilIAgZ3JlZWtnb2RzCiAgICDilILCoMKgIOKUgsKgwqAgICAgICAgICAgICAgICAgIOKUnOKUgOKUgCBhcGkKICAgIOKUgsKgwqAg4pSCwqDCoCAgICAgICAgICAgICAgICAg4pSCwqDCoCDilJzilIDilIAgR3JlZWtHb2RDb250cm9sbGVyLmphdmEKICAgIOKUgsKgwqAg4pSCwqDCoCAgICAgICAgICAgICAgICAg4pSCwqDCoCDilJTilIDilIAgR3JlZWtHb2RSZXNwb25zZS5qYXZhCiAgICDilILCoMKgIOKUgsKgwqAgICAgICAgICAgICAgICAgIOKUnOKUgOKUgCBkb21haW4KICAgIOKUgsKgwqAg4pSCwqDCoCAgICAgICAgICAgICAgICAg4pSCwqDCoCDilJzilIDilIAgR3JlZWtHb2QuamF2YQogICAg4pSCwqDCoCDilILCoMKgICAgICAgICAgICAgICAgICDilILCoMKgIOKUlOKUgOKUgCBHcmVla0dvZFJlcG9zaXRvcnkuamF2YQogICAg4pSCwqDCoCDilILCoMKgICAgICAgICAgICAgICAgICDilJzilIDilIAgR3JlZWtHb2RzQXBwbGljYXRpb24uamF2YQogICAg4pSCwqDCoCDilILCoMKgICAgICAgICAgICAgICAgICDilJTilIDilIAgc3luYwogICAg4pSCwqDCoCDilILCoMKgICAgICAgICAgICAgICAgICAgICAg4pSc4pSA4pSAIEdyZWVrR29kc0NsaWVudC5qYXZhCiAgICDilILCoMKgIOKUgsKgwqAgICAgICAgICAgICAgICAgICAgICDilJzilIDilIAgR3JlZWtHb2RzU3luY1Byb3BlcnRpZXMuamF2YQogICAg4pSCwqDCoCDilILCoMKgICAgICAgICAgICAgICAgICAgICAg4pSU4pSA4pSAIEdyZWVrR29kc1N5bmNTZXJ2aWNlLmphdmEKICAgIOKUgsKgwqAg4pSU4pSA4pSAIHJlc291cmNlcwogICAg4pSCwqDCoCAgICAg4pSc4pSA4pSAIGFwcGxpY2F0aW9uLnByb3BlcnRpZXMKICAgIOKUgsKgwqAgICAgIOKUlOKUgOKUgCBzY2hlbWEuc3FsCiAgICDilJTilIDilIAgdGVzdAogICAgICAgIOKUlOKUgOKUgCBqYXZhCiAgICAgICAgICAgIOKUlOKUgOKUgCBpbmZvCiAgICAgICAgICAgICAgICDilJTilIDilIAgamFiCiAgICAgICAgICAgICAgICAgICAg4pSU4pSA4pSAIHBsaW50aAogICAgICAgICAgICAgICAgICAgICAgICDilJTilIDilIAgZ3JlZWtnb2RzCiAgICAgICAgICAgICAgICAgICAgICAgICAgICDilJzilIDilIAgR3JlZWtHb2RzQVQuamF2YQogICAgICAgICAgICAgICAgICAgICAgICAgICAg4pSU4pSA4pSAIHN5bmMKICAgICAgICAgICAgICAgICAgICAgICAgICAgICAgICDilJTilIDilIAgR3JlZWtHb2RzU3luY1NlcnZpY2VUZXN0LmphdmEKCjIxIGRpcmVjdG9yaWVzLCAyMCBmaWxlcwo=",
    "pom_xml_b64": "PD94bWwgdmVyc2lvbj0iMS4wIiBlbmNvZGluZz0iVVRGLTgiPz4KPHByb2plY3QgeG1sbnM9Imh0dHA6Ly9tYXZlbi5hcGFjaGUub3JnL1BPTS80LjAuMCIKICAgICAgICAgeG1sbnM6eHNpPSJodHRwOi8vd3d3LnczLm9yZy8yMDAxL1hNTFNjaGVtYS1pbnN0YW5jZSIKICAgICAgICAgeHNpOnNjaGVtYUxvY2F0aW9uPSJodHRwOi8vbWF2ZW4uYXBhY2hlLm9yZy9QT00vNC4wLjAgaHR0cHM6Ly9tYXZlbi5hcGFjaGUub3JnL3hzZC9tYXZlbi00LjAuMC54c2QiPgogIDxtb2RlbFZlcnNpb24+NC4wLjA8L21vZGVsVmVyc2lvbj4KCiAgPHBhcmVudD4KICAgIDxncm91cElkPm9yZy5zcHJpbmdmcmFtZXdvcmsuYm9vdDwvZ3JvdXBJZD4KICAgIDxhcnRpZmFjdElkPnNwcmluZy1ib290LXN0YXJ0ZXItcGFyZW50PC9hcnRpZmFjdElkPgogICAgPHZlcnNpb24+NC4wLjI8L3ZlcnNpb24+CiAgICA8cmVsYXRpdmVQYXRoLz4KICA8L3BhcmVudD4KCiAgPGdyb3VwSWQ+aW5mby5qYWIucGxpbnRoPC9ncm91cElkPgogIDxhcnRpZmFjdElkPmdyZWVrLWdvZHMtYXBpPC9hcnRpZmFjdElkPgogIDx2ZXJzaW9uPjEuMC4wLVNOQVBTSE9UPC92ZXJzaW9uPgogIDxwYWNrYWdpbmc+amFyPC9wYWNrYWdpbmc+CiAgPG5hbWU+Z3JlZWstZ29kcy1hcGk8L25hbWU+CiAgPGRlc2NyaXB0aW9uPlJFU1QgQVBJIGV4cG9zaW5nIEdyZWVrIGdvZHMgc3luY2hyb25pemVkIHBlcmlvZGljYWxseSBmcm9tIGEgdGhpcmQtcGFydHkgc2VydmljZTwvZGVzY3JpcHRpb24+CgogIDxwcm9wZXJ0aWVzPgogICAgPGphdmEudmVyc2lvbj4yNTwvamF2YS52ZXJzaW9uPgogICAgPHByb2plY3QuYnVpbGQuc291cmNlRW5jb2Rpbmc+VVRGLTg8L3Byb2plY3QuYnVpbGQuc291cmNlRW5jb2Rpbmc+CiAgICA8d2lyZW1vY2sudmVyc2lvbj4zLjEzLjE8L3dpcmVtb2NrLnZlcnNpb24+CiAgPC9wcm9wZXJ0aWVzPgoKICA8ZGVwZW5kZW5jaWVzPgogICAgPGRlcGVuZGVuY3k+CiAgICAgIDxncm91cElkPm9yZy5zcHJpbmdmcmFtZXdvcmsuYm9vdDwvZ3JvdXBJZD4KICAgICAgPGFydGlmYWN0SWQ+c3ByaW5nLWJvb3Qtc3RhcnRlci13ZWI8L2FydGlmYWN0SWQ+CiAgICA8L2RlcGVuZGVuY3k+CiAgICA8ZGVwZW5kZW5jeT4KICAgICAgPGdyb3VwSWQ+b3JnLnNwcmluZ2ZyYW1ld29yay5ib290PC9ncm91cElkPgogICAgICA8YXJ0aWZhY3RJZD5zcHJpbmctYm9vdC1zdGFydGVyLWRhdGEtamRiYzwvYXJ0aWZhY3RJZD4KICAgIDwvZGVwZW5kZW5jeT4KICAgIDxkZXBlbmRlbmN5PgogICAgICA8Z3JvdXBJZD5vcmcuc3ByaW5nZnJhbWV3b3JrLmJvb3Q8L2dyb3VwSWQ+CiAgICAgIDxhcnRpZmFjdElkPnNwcmluZy1ib290LXN0YXJ0ZXItcmVzdGNsaWVudDwvYXJ0aWZhY3RJZD4KICAgIDwvZGVwZW5kZW5jeT4KICAgIDxkZXBlbmRlbmN5PgogICAgICA8Z3JvdXBJZD5jb20uaDJkYXRhYmFzZTwvZ3JvdXBJZD4KICAgICAgPGFydGlmYWN0SWQ+aDI8L2FydGlmYWN0SWQ+CiAgICAgIDxzY29wZT5ydW50aW1lPC9zY29wZT4KICAgIDwvZGVwZW5kZW5jeT4KCiAgICA8ZGVwZW5kZW5jeT4KICAgICAgPGdyb3VwSWQ+b3JnLnNwcmluZ2ZyYW1ld29yay5ib290PC9ncm91cElkPgogICAgICA8YXJ0aWZhY3RJZD5zcHJpbmctYm9vdC1zdGFydGVyLXRlc3Q8L2FydGlmYWN0SWQ+CiAgICAgIDxzY29wZT50ZXN0PC9zY29wZT4KICAgIDwvZGVwZW5kZW5jeT4KICAgIDxkZXBlbmRlbmN5PgogICAgICA8Z3JvdXBJZD5vcmcuc3ByaW5nZnJhbWV3b3JrLmJvb3Q8L2dyb3VwSWQ+CiAgICAgIDxhcnRpZmFjdElkPnNwcmluZy1ib290LXJlc3R0ZXN0Y2xpZW50PC9hcnRpZmFjdElkPgogICAgICA8c2NvcGU+dGVzdDwvc2NvcGU+CiAgICA8L2RlcGVuZGVuY3k+CiAgICA8ZGVwZW5kZW5jeT4KICAgICAgPGdyb3VwSWQ+b3JnLndpcmVtb2NrPC9ncm91cElkPgogICAgICA8YXJ0aWZhY3RJZD53aXJlbW9jay1zdGFuZGFsb25lPC9hcnRpZmFjdElkPgogICAgICA8dmVyc2lvbj4ke3dpcmVtb2NrLnZlcnNpb259PC92ZXJzaW9uPgogICAgICA8c2NvcGU+dGVzdDwvc2NvcGU+CiAgICA8L2RlcGVuZGVuY3k+CiAgPC9kZXBlbmRlbmNpZXM+CgogIDxidWlsZD4KICAgIDxwbHVnaW5zPgogICAgICA8cGx1Z2luPgogICAgICAgIDxncm91cElkPm9yZy5zcHJpbmdmcmFtZXdvcmsuYm9vdDwvZ3JvdXBJZD4KICAgICAgICA8YXJ0aWZhY3RJZD5zcHJpbmctYm9vdC1tYXZlbi1wbHVnaW48L2FydGlmYWN0SWQ+CiAgICAgIDwvcGx1Z2luPgogICAgICA8cGx1Z2luPgogICAgICAgIDxncm91cElkPm9yZy5hcGFjaGUubWF2ZW4ucGx1Z2luczwvZ3JvdXBJZD4KICAgICAgICA8YXJ0aWZhY3RJZD5tYXZlbi1zdXJlZmlyZS1wbHVnaW48L2FydGlmYWN0SWQ+CiAgICAgICAgPGNvbmZpZ3VyYXRpb24+CiAgICAgICAgICA8aW5jbHVkZXM+CiAgICAgICAgICAgIDxpbmNsdWRlPioqLypUZXN0LmphdmE8L2luY2x1ZGU+CiAgICAgICAgICA8L2luY2x1ZGVzPgogICAgICAgICAgPGV4Y2x1ZGVzPgogICAgICAgICAgICA8ZXhjbHVkZT4qKi8qSVQuamF2YTwvZXhjbHVkZT4KICAgICAgICAgICAgPGV4Y2x1ZGU+KiovKkFULmphdmE8L2V4Y2x1ZGU+CiAgICAgICAgICA8L2V4Y2x1ZGVzPgogICAgICAgIDwvY29uZmlndXJhdGlvbj4KICAgICAgPC9wbHVnaW4+CiAgICAgIDxwbHVnaW4+CiAgICAgICAgPGdyb3VwSWQ+b3JnLmFwYWNoZS5tYXZlbi5wbHVnaW5zPC9ncm91cElkPgogICAgICAgIDxhcnRpZmFjdElkPm1hdmVuLWZhaWxzYWZlLXBsdWdpbjwvYXJ0aWZhY3RJZD4KICAgICAgICA8Y29uZmlndXJhdGlvbj4KICAgICAgICAgIDxpbmNsdWRlcz4KICAgICAgICAgICAgPGluY2x1ZGU+KiovKklULmphdmE8L2luY2x1ZGU+CiAgICAgICAgICAgIDxpbmNsdWRlPioqLypBVC5qYXZhPC9pbmNsdWRlPgogICAgICAgICAgPC9pbmNsdWRlcz4KICAgICAgICA8L2NvbmZpZ3VyYXRpb24+CiAgICAgICAgPGV4ZWN1dGlvbnM+CiAgICAgICAgICA8ZXhlY3V0aW9uPgogICAgICAgICAgICA8Z29hbHM+CiAgICAgICAgICAgICAgPGdvYWw+aW50ZWdyYXRpb24tdGVzdDwvZ29hbD4KICAgICAgICAgICAgICA8Z29hbD52ZXJpZnk8L2dvYWw+CiAgICAgICAgICAgIDwvZ29hbHM+CiAgICAgICAgICA8L2V4ZWN1dGlvbj4KICAgICAgICA8L2V4ZWN1dGlvbnM+CiAgICAgIDwvcGx1Z2luPgogICAgPC9wbHVnaW5zPgogIDwvYnVpbGQ+CjwvcHJvamVjdD4K",
    "file_count": 19
  }
}
