{
  "efficiency": {
    "wall_clock_s": 900,
    "active_agent_s": 870,
    "tokens_in": 45000,
    "tokens_out": 12000,
    "tokens_total": 57000,
    "cost_usd": 0.35
  },
  "outcome_quality": {
    "acceptance_pass": true,
    "acceptance_coverage": 1.0,
    "rework_turns": 0,
    "artifact_completeness": 1.0
  },
  "protocol_labels": {
    "scenario": "scenario1",
    "case_id": "case-1-readme-only",
    "tool": "claude-code",
    "model": "claude-sonnet-5",
    "plinth_config": "plinth-skills",
    "commit": "d3bba05ebe85dd00dc8a3ec462db5e3223c9e8d",
    "retry_count": 0,
    "human_intervention_min": 0
  },
  "plinth_usage": {
    "skills_count": 3,
    "commands_count": 0,
    "agents_count": 0,
    "skills": [
      "300-frameworks-spring-boot-create-project",
      "302-frameworks-spring-boot-rest",
      "322-frameworks-spring-boot-testing-integration-tests"
    ],
    "commands": [],
    "agents": []
  },
  "solution_snapshot": {
    "demo_root": "benchmarks/problem2/scenario1/demo/",
    "tree_format": "unix-tree",
    "tree_encoding": "base64",
    "tree_b64": "LgrilJzilIDilIAgLmdpdGtlZXAK4pSc4pSA4pSAIHBvbS54bWwK4pSU4pSA4pSAIHNyYwogICAg4pSc4pSA4pSAIG1haW4KICAgIOKUgsKgwqAg4pSc4pSA4pSAIGphdmEKICAgIOKUgsKgwqAg4pSCwqDCoCDilJTilIDilIAgaW5mbwogICAg4pSCwqDCoCDilILCoMKgICAgICAg4pSU4pSA4pSAIGphYgogICAg4pSCwqDCoCDilILCoMKgICAgICAgICAg4pSU4pSA4pSAIHBsaW50aAogICAg4pSCwqDCoCDilILCoMKgICAgICAgICAgICAgIOKUlOKUgOKUgCBncmVla2dvZHNhcGkKICAgIOKUgsKgwqAg4pSCwqDCoCAgICAgICAgICAgICAgICAg4pSc4pSA4pSAIEdyZWVrR29kc0FwaUFwcGxpY2F0aW9uLmphdmEKICAgIOKUgsKgwqAg4pSCwqDCoCAgICAgICAgICAgICAgICAg4pSc4pSA4pSAIGRvbWFpbgogICAg4pSCwqDCoCDilILCoMKgICAgICAgICAgICAgICAgICDilILCoMKgIOKUnOKUgOKUgCBHb2RSZWNvcmQuamF2YQogICAg4pSCwqDCoCDilILCoMKgICAgICAgICAgICAgICAgICDilILCoMKgIOKUnOKUgOKUgCBHb2RSZXBvc2l0b3J5LmphdmEKICAgIOKUgsKgwqAg4pSCwqDCoCAgICAgICAgICAgICAgICAg4pSCwqDCoCDilJTilIDilIAgSW5NZW1vcnlHb2RSZXBvc2l0b3J5LmphdmEKICAgIOKUgsKgwqAg4pSCwqDCoCAgICAgICAgICAgICAgICAg4pSc4pSA4pSAIHN5bmMKICAgIOKUgsKgwqAg4pSCwqDCoCAgICAgICAgICAgICAgICAg4pSCwqDCoCDilJzilIDilIAgR29kU3luY1NjaGVkdWxlci5qYXZhCiAgICDilILCoMKgIOKUgsKgwqAgICAgICAgICAgICAgICAgIOKUgsKgwqAg4pSc4pSA4pSAIEdvZFN5bmNTZXJ2aWNlLmphdmEKICAgIOKUgsKgwqAg4pSCwqDCoCAgICAgICAgICAgICAgICAg4pSCwqDCoCDilJzilIDilIAgUmVzdENsaWVudFRoaXJkUGFydHlHb2RDbGllbnQuamF2YQogICAg4pSCwqDCoCDilILCoMKgICAgICAgICAgICAgICAgICDilILCoMKgIOKUlOKUgOKUgCBUaGlyZFBhcnR5R29kQ2xpZW50LmphdmEKICAgIOKUgsKgwqAg4pSCwqDCoCAgICAgICAgICAgICAgICAg4pSU4pSA4pSAIHdlYgogICAg4pSCwqDCoCDilILCoMKgICAgICAgICAgICAgICAgICAgICAg4pSc4pSA4pSAIEdvZFJlc3BvbnNlLmphdmEKICAgIOKUgsKgwqAg4pSCwqDCoCAgICAgICAgICAgICAgICAgICAgIOKUlOKUgOKUgCBHcmVla0dvZHNDb250cm9sbGVyLmphdmEKICAgIOKUgsKgwqAg4pSU4pSA4pSAIHJlc291cmNlcwogICAg4pSCwqDCoCAgICAg4pSU4pSA4pSAIGFwcGxpY2F0aW9uLnltbAogICAg4pSU4pSA4pSAIHRlc3QKICAgICAgICDilJTilIDilIAgamF2YQogICAgICAgICAgICDilJTilIDilIAgaW5mbwogICAgICAgICAgICAgICAg4pSU4pSA4pSAIGphYgogICAgICAgICAgICAgICAgICAgIOKUlOKUgOKUgCBwbGludGgKICAgICAgICAgICAgICAgICAgICAgICAg4pSU4pSA4pSAIGdyZWVrZ29kc2FwaQogICAgICAgICAgICAgICAgICAgICAgICAgICAg4pSU4pSA4pSAIEdyZWVrR29kc0FwaUhhcHB5UGF0aFRlc3QuamF2YQoKMTggZGlyZWN0b3JpZXMsIDE0IGZpbGVzCg==",
    "pom_xml_b64": "PD94bWwgdmVyc2lvbj0iMS4wIiBlbmNvZGluZz0iVVRGLTgiPz4KPHByb2plY3QgeG1sbnM9Imh0dHA6Ly9tYXZlbi5hcGFjaGUub3JnL1BPTS80LjAuMCIKICAgICAgICAgeG1sbnM6eHNpPSJodHRwOi8vd3d3LnczLm9yZy8yMDAxL1hNTFNjaGVtYS1pbnN0YW5jZSIKICAgICAgICAgeHNpOnNjaGVtYUxvY2F0aW9uPSJodHRwOi8vbWF2ZW4uYXBhY2hlLm9yZy9QT00vNC4wLjAgaHR0cHM6Ly9tYXZlbi5hcGFjaGUub3JnL3hzZC9tYXZlbi00LjAuMC54c2QiPgogIDxtb2RlbFZlcnNpb24+NC4wLjA8L21vZGVsVmVyc2lvbj4KCiAgPHBhcmVudD4KICAgIDxncm91cElkPm9yZy5zcHJpbmdmcmFtZXdvcmsuYm9vdDwvZ3JvdXBJZD4KICAgIDxhcnRpZmFjdElkPnNwcmluZy1ib290LXN0YXJ0ZXItcGFyZW50PC9hcnRpZmFjdElkPgogICAgPHZlcnNpb24+NC4wLjY8L3ZlcnNpb24+CiAgICA8cmVsYXRpdmVQYXRoLz4KICA8L3BhcmVudD4KCiAgPGdyb3VwSWQ+aW5mby5qYWIucGxpbnRoPC9ncm91cElkPgogIDxhcnRpZmFjdElkPmdyZWVrLWdvZHMtYXBpPC9hcnRpZmFjdElkPgogIDx2ZXJzaW9uPjEuMC4wLVNOQVBTSE9UPC92ZXJzaW9uPgogIDxwYWNrYWdpbmc+amFyPC9wYWNrYWdpbmc+CiAgPG5hbWU+Z3JlZWstZ29kcy1hcGk8L25hbWU+CiAgPGRlc2NyaXB0aW9uPkdyZWVrIEdvZHMgQVBJIGRlbW8gZm9yIFBsaW50aCBiZW5jaG1hcmsgc2NlbmFyaW8gMTwvZGVzY3JpcHRpb24+CgogIDxwcm9wZXJ0aWVzPgogICAgPGphdmEudmVyc2lvbj4yNTwvamF2YS52ZXJzaW9uPgogIDwvcHJvcGVydGllcz4KCiAgPGRlcGVuZGVuY2llcz4KICAgIDxkZXBlbmRlbmN5PgogICAgICA8Z3JvdXBJZD5vcmcuc3ByaW5nZnJhbWV3b3JrLmJvb3Q8L2dyb3VwSWQ+CiAgICAgIDxhcnRpZmFjdElkPnNwcmluZy1ib290LXN0YXJ0ZXItd2ViPC9hcnRpZmFjdElkPgogICAgPC9kZXBlbmRlbmN5PgoKICAgIDxkZXBlbmRlbmN5PgogICAgICA8Z3JvdXBJZD5vcmcuc3ByaW5nZnJhbWV3b3JrLmJvb3Q8L2dyb3VwSWQ+CiAgICAgIDxhcnRpZmFjdElkPnNwcmluZy1ib290LXN0YXJ0ZXItcmVzdGNsaWVudDwvYXJ0aWZhY3RJZD4KICAgIDwvZGVwZW5kZW5jeT4KCiAgICA8ZGVwZW5kZW5jeT4KICAgICAgPGdyb3VwSWQ+b3JnLnNwcmluZ2ZyYW1ld29yay5ib290PC9ncm91cElkPgogICAgICA8YXJ0aWZhY3RJZD5zcHJpbmctYm9vdC1zdGFydGVyLXRlc3Q8L2FydGlmYWN0SWQ+CiAgICAgIDxzY29wZT50ZXN0PC9zY29wZT4KICAgIDwvZGVwZW5kZW5jeT4KCiAgICA8ZGVwZW5kZW5jeT4KICAgICAgPGdyb3VwSWQ+b3JnLnNwcmluZ2ZyYW1ld29yay5ib290PC9ncm91cElkPgogICAgICA8YXJ0aWZhY3RJZD5zcHJpbmctYm9vdC1yZXN0dGVzdGNsaWVudDwvYXJ0aWZhY3RJZD4KICAgICAgPHNjb3BlPnRlc3Q8L3Njb3BlPgogICAgPC9kZXBlbmRlbmN5PgogIDwvZGVwZW5kZW5jaWVzPgoKICA8YnVpbGQ+CiAgICA8cGx1Z2lucz4KICAgICAgPHBsdWdpbj4KICAgICAgICA8Z3JvdXBJZD5vcmcuc3ByaW5nZnJhbWV3b3JrLmJvb3Q8L2dyb3VwSWQ+CiAgICAgICAgPGFydGlmYWN0SWQ+c3ByaW5nLWJvb3QtbWF2ZW4tcGx1Z2luPC9hcnRpZmFjdElkPgogICAgICA8L3BsdWdpbj4KICAgIDwvcGx1Z2lucz4KICA8L2J1aWxkPgoKPC9wcm9qZWN0Pgo=",
    "file_count": 13
  }
}
